Using custom data configuration default-45263a531a701e55
Reusing dataset json (/home/lily/lyf6/.cache/huggingface/datasets/json/default-45263a531a701e55/0.0.0/ac0ca5f5289a6cf108e706efcf040422dbbfa8e658dee6a819f20d76bb84d26b)
Using dataset: testfile
  0%|          | 0/1 [00:00<?, ?it/s]100%|██████████| 1/1 [00:00<00:00, 403.57it/s]
Using custom data configuration default-d9d706ff46131c58
Reusing dataset json (/home/lily/lyf6/.cache/huggingface/datasets/json/default-d9d706ff46131c58/0.0.0/ac0ca5f5289a6cf108e706efcf040422dbbfa8e658dee6a819f20d76bb84d26b)
  0%|          | 0/1 [00:00<?, ?it/s]100%|██████████| 1/1 [00:00<00:00, 488.73it/s]
Loading cached processed dataset at /home/lily/lyf6/.cache/huggingface/datasets/json/default-45263a531a701e55/0.0.0/ac0ca5f5289a6cf108e706efcf040422dbbfa8e658dee6a819f20d76bb84d26b/cache-ccf47721c653e355.arrow
  0%|          | 0/1 [00:00<?, ?ba/s]100%|██████████| 1/1 [00:00<00:00, 13.05ba/s]
/home/lily/lyf6/miniconda3/envs/simplification/lib/python3.8/site-packages/transformers/optimization.py:346: FutureWarning: This implementation of AdamW is deprecated and will be removed in a future version. Use the PyTorch implementation torch.optim.AdamW instead, or set `no_deprecation_warning=True` to disable this warning
  warnings.warn(
wandb: Currently logged in as: ljyflores_team (use `wandb login --relogin` to force relogin)
wandb: wandb version 0.13.11 is available!  To upgrade, please run:
wandb:  $ pip install wandb --upgrade
wandb: Tracking run with wandb version 0.12.9
wandb: Syncing run pious-glitter-48
wandb:  View project at https://wandb.ai/ljyflores_team/huggingface
wandb:  View run at https://wandb.ai/ljyflores_team/huggingface/runs/29zo1g9f
wandb: Run data is saved locally in /data/lily/lyf6/Simplification-Project/wandb/run-20230309_142135-29zo1g9f
wandb: Run `wandb offline` to turn off syncing.

  0% 0/242 [00:00<?, ?it/s]/home/lily/lyf6/miniconda3/envs/simplification/lib/python3.8/site-packages/torch/nn/parallel/_functions.py:68: UserWarning: Was asked to gather along dimension 0, but all input tensors were scalars; will instead unsqueeze and return a vector.
  warnings.warn('Was asked to gather along dimension 0, but all '
  0% 1/242 [00:05<20:13,  5.03s/it]  1% 2/242 [00:05<09:48,  2.45s/it]  1% 3/242 [00:06<06:28,  1.63s/it]  2% 4/242 [00:07<05:13,  1.32s/it]  2% 5/242 [00:07<04:20,  1.10s/it]  2% 6/242 [00:08<03:46,  1.04it/s]  3% 7/242 [00:09<03:24,  1.15it/s]  3% 8/242 [00:09<03:09,  1.23it/s]  4% 9/242 [00:10<02:59,  1.29it/s]  4% 10/242 [00:11<02:52,  1.34it/s]  5% 11/242 [00:12<02:48,  1.37it/s]  5% 12/242 [00:12<02:45,  1.39it/s]  5% 13/242 [00:13<02:43,  1.40it/s]  6% 14/242 [00:14<02:40,  1.42it/s]  6% 15/242 [00:14<02:38,  1.43it/s]  7% 16/242 [00:15<02:37,  1.43it/s]  7% 17/242 [00:16<02:36,  1.44it/s]  7% 18/242 [00:16<02:35,  1.44it/s]  8% 19/242 [00:17<02:34,  1.45it/s]  8% 20/242 [00:18<02:32,  1.45it/s]  9% 21/242 [00:18<02:32,  1.45it/s]  9% 22/242 [00:19<02:28,  1.48it/s] 10% 23/242 [00:20<02:32,  1.43it/s] 10% 24/242 [00:20<02:28,  1.47it/s] 10% 25/242 [00:21<02:28,  1.46it/s] 11% 26/242 [00:22<02:28,  1.45it/s] 11% 27/242 [00:23<02:27,  1.45it/s] 12% 28/242 [00:23<02:27,  1.46it/s] 12% 29/242 [00:24<02:26,  1.46it/s] 12% 30/242 [00:25<02:25,  1.45it/s] 13% 31/242 [00:25<02:25,  1.45it/s] 13% 32/242 [00:26<02:25,  1.44it/s] 14% 33/242 [00:27<02:24,  1.45it/s] 14% 34/242 [00:27<02:23,  1.45it/s] 14% 35/242 [00:28<02:22,  1.45it/s] 15% 36/242 [00:29<02:21,  1.45it/s] 15% 37/242 [00:30<02:34,  1.33it/s] 16% 38/242 [00:30<02:29,  1.36it/s] 16% 39/242 [00:31<02:25,  1.39it/s] 17% 40/242 [00:32<02:20,  1.44it/s] 17% 41/242 [00:32<02:18,  1.45it/s] 17% 42/242 [00:33<02:17,  1.45it/s] 18% 43/242 [00:34<02:17,  1.45it/s] 18% 44/242 [00:34<02:16,  1.45it/s] 19% 45/242 [00:35<02:15,  1.45it/s] 19% 46/242 [00:36<02:14,  1.46it/s] 19% 47/242 [00:36<02:14,  1.45it/s] 20% 48/242 [00:37<02:13,  1.45it/s] 20% 49/242 [00:38<02:13,  1.45it/s] 21% 50/242 [00:39<02:12,  1.45it/s] 21% 51/242 [00:39<02:11,  1.46it/s] 21% 52/242 [00:40<02:10,  1.46it/s] 22% 53/242 [00:41<02:09,  1.46it/s] 22% 54/242 [00:41<02:09,  1.45it/s] 23% 55/242 [00:42<02:10,  1.44it/s] 23% 56/242 [00:43<02:09,  1.44it/s] 24% 57/242 [00:43<02:08,  1.44it/s] 24% 58/242 [00:44<02:07,  1.44it/s] 24% 59/242 [00:45<02:06,  1.45it/s] 25% 60/242 [00:45<02:06,  1.44it/s] 25% 61/242 [00:46<02:05,  1.45it/s] 26% 62/242 [00:47<02:04,  1.44it/s] 26% 63/242 [00:48<02:03,  1.44it/s] 26% 64/242 [00:48<02:04,  1.43it/s] 27% 65/242 [00:49<02:02,  1.44it/s] 27% 66/242 [00:50<02:01,  1.44it/s] 28% 67/242 [00:50<02:00,  1.45it/s] 28% 68/242 [00:51<01:59,  1.45it/s] 29% 69/242 [00:52<01:59,  1.45it/s] 29% 70/242 [00:52<01:58,  1.46it/s] 29% 71/242 [00:53<01:57,  1.45it/s] 30% 72/242 [00:54<01:58,  1.43it/s] 30% 73/242 [00:54<01:58,  1.43it/s] 31% 74/242 [00:55<01:57,  1.43it/s] 31% 75/242 [00:56<01:56,  1.44it/s] 31% 76/242 [00:57<01:55,  1.44it/s] 32% 77/242 [00:57<01:54,  1.44it/s] 32% 78/242 [00:58<01:53,  1.44it/s] 33% 79/242 [00:59<01:53,  1.44it/s] 33% 80/242 [00:59<01:52,  1.44it/s] 33% 81/242 [01:00<01:51,  1.44it/s] 34% 82/242 [01:01<01:50,  1.45it/s] 34% 83/242 [01:02<01:56,  1.36it/s] 35% 84/242 [01:02<01:53,  1.39it/s] 35% 85/242 [01:03<01:51,  1.41it/s] 36% 86/242 [01:04<01:49,  1.42it/s] 36% 87/242 [01:04<01:48,  1.43it/s] 36% 88/242 [01:05<01:47,  1.43it/s] 37% 89/242 [01:06<01:46,  1.44it/s] 37% 90/242 [01:06<01:45,  1.44it/s] 38% 91/242 [01:07<01:44,  1.45it/s] 38% 92/242 [01:08<01:43,  1.46it/s] 38% 93/242 [01:08<01:43,  1.45it/s] 39% 94/242 [01:09<01:42,  1.45it/s] 39% 95/242 [01:10<01:41,  1.45it/s] 40% 96/242 [01:10<01:40,  1.45it/s] 40% 97/242 [01:11<01:39,  1.45it/s] 40% 98/242 [01:12<01:39,  1.45it/s] 41% 99/242 [01:13<01:38,  1.45it/s] 41% 100/242 [01:13<01:37,  1.45it/s] 42% 101/242 [01:14<01:37,  1.45it/s] 42% 102/242 [01:15<01:36,  1.45it/s] 43% 103/242 [01:15<01:36,  1.45it/s] 43% 104/242 [01:16<01:35,  1.44it/s] 43% 105/242 [01:17<01:35,  1.43it/s] 44% 106/242 [01:17<01:35,  1.42it/s] 44% 107/242 [01:18<01:34,  1.43it/s] 45% 108/242 [01:19<01:33,  1.43it/s] 45% 109/242 [01:19<01:32,  1.44it/s] 45% 110/242 [01:20<01:31,  1.44it/s] 46% 111/242 [01:21<01:31,  1.44it/s] 46% 112/242 [01:22<01:30,  1.44it/s] 47% 113/242 [01:22<01:29,  1.44it/s] 47% 114/242 [01:23<01:30,  1.42it/s] 48% 115/242 [01:24<01:29,  1.42it/s] 48% 116/242 [01:24<01:28,  1.43it/s] 48% 117/242 [01:25<01:26,  1.44it/s] 49% 118/242 [01:26<01:25,  1.45it/s] 49% 119/242 [01:27<01:29,  1.37it/s] 50% 120/242 [01:27<01:27,  1.39it/s] 50% 121/242 [01:28<01:26,  1.41it/s]
  0% 0/32 [00:00<?, ?it/s][A
  6% 2/32 [00:00<00:11,  2.54it/s][A
  9% 3/32 [00:01<00:15,  1.90it/s][A
 12% 4/32 [00:02<00:17,  1.60it/s][A
 16% 5/32 [00:03<00:18,  1.47it/s][A
 19% 6/32 [00:03<00:18,  1.39it/s][A
 22% 7/32 [00:04<00:18,  1.35it/s][A
 25% 8/32 [00:05<00:18,  1.31it/s][A
 28% 9/32 [00:06<00:17,  1.30it/s][A
 31% 10/32 [00:07<00:16,  1.30it/s][A
 34% 11/32 [00:07<00:16,  1.30it/s][A
 38% 12/32 [00:08<00:15,  1.30it/s][A
 41% 13/32 [00:09<00:14,  1.30it/s][A
 44% 14/32 [00:10<00:13,  1.31it/s][A
 47% 15/32 [00:10<00:13,  1.28it/s][A
 50% 16/32 [00:11<00:12,  1.28it/s][A
 53% 17/32 [00:12<00:11,  1.27it/s][A
 56% 18/32 [00:13<00:10,  1.28it/s][A
 59% 19/32 [00:14<00:10,  1.29it/s][A
 62% 20/32 [00:14<00:09,  1.30it/s][A
 66% 21/32 [00:15<00:08,  1.32it/s][A
 69% 22/32 [00:16<00:07,  1.33it/s][A
 72% 23/32 [00:17<00:06,  1.32it/s][A
 75% 24/32 [00:17<00:06,  1.33it/s][A
 78% 25/32 [00:18<00:05,  1.33it/s][A
 81% 26/32 [00:19<00:04,  1.32it/s][A
 84% 27/32 [00:20<00:03,  1.28it/s][A
 88% 28/32 [00:20<00:03,  1.25it/s][A
 91% 29/32 [00:21<00:02,  1.24it/s][A
 94% 30/32 [00:22<00:01,  1.25it/s][A
 97% 31/32 [00:23<00:00,  1.24it/s][A
100% 32/32 [00:23<00:00,  1.36it/s][A
                                   [A 50% 121/242 [02:15<01:26,  1.41it/s]
100% 32/32 [00:45<00:00,  1.36it/s][A
                                   [A 50% 122/242 [02:15<29:26, 14.72s/it] 51% 123/242 [02:16<20:51, 10.51s/it] 51% 124/242 [02:17<14:53,  7.57s/it] 52% 125/242 [02:17<10:45,  5.51s/it] 52% 126/242 [02:18<07:51,  4.07s/it] 52% 127/242 [02:19<05:51,  3.05s/it] 53% 128/242 [02:20<04:27,  2.35s/it] 53% 129/242 [02:20<03:29,  1.85s/it] 54% 130/242 [02:21<02:48,  1.50s/it] 54% 131/242 [02:22<02:19,  1.26s/it] 55% 132/242 [02:22<01:59,  1.08s/it] 55% 133/242 [02:23<01:45,  1.03it/s] 55% 134/242 [02:24<01:35,  1.13it/s] 56% 135/242 [02:25<01:34,  1.14it/s] 56% 136/242 [02:25<01:27,  1.21it/s] 57% 137/242 [02:26<01:22,  1.28it/s] 57% 138/242 [02:27<01:18,  1.32it/s] 57% 139/242 [02:27<01:16,  1.36it/s] 58% 140/242 [02:28<01:14,  1.38it/s] 58% 141/242 [02:29<01:12,  1.40it/s] 59% 142/242 [02:29<01:10,  1.41it/s] 59% 143/242 [02:30<01:09,  1.42it/s] 60% 144/242 [02:31<01:08,  1.43it/s] 60% 145/242 [02:31<01:07,  1.44it/s] 60% 146/242 [02:32<01:06,  1.43it/s] 61% 147/242 [02:33<01:05,  1.44it/s] 61% 148/242 [02:34<01:05,  1.44it/s] 62% 149/242 [02:34<01:04,  1.44it/s] 62% 150/242 [02:35<01:04,  1.44it/s] 62% 151/242 [02:36<01:03,  1.44it/s] 63% 152/242 [02:36<01:02,  1.44it/s] 63% 153/242 [02:37<01:01,  1.44it/s] 64% 154/242 [02:38<01:00,  1.44it/s] 64% 155/242 [02:38<01:00,  1.43it/s] 64% 156/242 [02:39<00:59,  1.44it/s] 65% 157/242 [02:40<00:58,  1.44it/s] 65% 158/242 [02:40<00:58,  1.45it/s] 66% 159/242 [02:41<00:57,  1.44it/s] 66% 160/242 [02:42<00:57,  1.43it/s] 67% 161/242 [02:43<00:57,  1.42it/s] 67% 162/242 [02:43<00:56,  1.42it/s] 67% 163/242 [02:44<00:55,  1.43it/s] 68% 164/242 [02:45<00:54,  1.44it/s] 68% 165/242 [02:45<00:53,  1.44it/s] 69% 166/242 [02:46<00:52,  1.45it/s] 69% 167/242 [02:47<00:51,  1.45it/s] 69% 168/242 [02:47<00:51,  1.45it/s] 70% 169/242 [02:48<00:50,  1.45it/s] 70% 170/242 [02:49<00:49,  1.44it/s] 71% 171/242 [02:50<00:49,  1.42it/s] 71% 172/242 [02:50<00:53,  1.31it/s] 71% 173/242 [02:51<00:51,  1.34it/s] 72% 174/242 [02:52<00:49,  1.37it/s] 72% 175/242 [02:53<00:48,  1.39it/s] 73% 176/242 [02:53<00:46,  1.41it/s] 73% 177/242 [02:54<00:45,  1.42it/s] 74% 178/242 [02:55<00:44,  1.43it/s] 74% 179/242 [02:55<00:43,  1.44it/s] 74% 180/242 [02:56<00:42,  1.44it/s] 75% 181/242 [02:57<00:42,  1.44it/s] 75% 182/242 [02:57<00:41,  1.45it/s] 76% 183/242 [02:58<00:40,  1.45it/s] 76% 184/242 [02:59<00:39,  1.45it/s] 76% 185/242 [02:59<00:39,  1.45it/s] 77% 186/242 [03:00<00:38,  1.45it/s] 77% 187/242 [03:01<00:37,  1.46it/s] 78% 188/242 [03:01<00:36,  1.46it/s] 78% 189/242 [03:02<00:36,  1.47it/s] 79% 190/242 [03:03<00:35,  1.46it/s] 79% 191/242 [03:04<00:35,  1.45it/s] 79% 192/242 [03:04<00:34,  1.46it/s] 80% 193/242 [03:05<00:33,  1.45it/s] 80% 194/242 [03:06<00:33,  1.45it/s] 81% 195/242 [03:06<00:32,  1.45it/s] 81% 196/242 [03:07<00:31,  1.45it/s] 81% 197/242 [03:08<00:30,  1.46it/s] 82% 198/242 [03:08<00:30,  1.46it/s] 82% 199/242 [03:09<00:29,  1.46it/s] 83% 200/242 [03:10<00:28,  1.45it/s] 83% 201/242 [03:10<00:28,  1.45it/s] 83% 202/242 [03:11<00:27,  1.44it/s] 84% 203/242 [03:12<00:26,  1.45it/s] 84% 204/242 [03:12<00:26,  1.45it/s] 85% 205/242 [03:13<00:25,  1.45it/s] 85% 206/242 [03:14<00:24,  1.45it/s] 86% 207/242 [03:15<00:23,  1.48it/s] 86% 208/242 [03:15<00:23,  1.46it/s] 86% 209/242 [03:16<00:22,  1.45it/s] 87% 210/242 [03:17<00:22,  1.45it/s] 87% 211/242 [03:17<00:21,  1.45it/s] 88% 212/242 [03:18<00:20,  1.45it/s] 88% 213/242 [03:19<00:19,  1.45it/s] 88% 214/242 [03:19<00:19,  1.45it/s] 89% 215/242 [03:20<00:18,  1.46it/s] 89% 216/242 [03:21<00:17,  1.46it/s] 90% 217/242 [03:21<00:17,  1.46it/s] 90% 218/242 [03:22<00:16,  1.45it/s] 90% 219/242 [03:23<00:17,  1.34it/s] 91% 220/242 [03:24<00:16,  1.36it/s] 91% 221/242 [03:24<00:15,  1.37it/s] 92% 222/242 [03:25<00:14,  1.40it/s] 92% 223/242 [03:26<00:13,  1.42it/s] 93% 224/242 [03:26<00:12,  1.44it/s] 93% 225/242 [03:27<00:11,  1.44it/s] 93% 226/242 [03:28<00:11,  1.45it/s] 94% 227/242 [03:29<00:10,  1.43it/s] 94% 228/242 [03:29<00:09,  1.44it/s] 95% 229/242 [03:30<00:09,  1.43it/s] 95% 230/242 [03:31<00:08,  1.44it/s] 95% 231/242 [03:31<00:07,  1.45it/s] 96% 232/242 [03:32<00:06,  1.45it/s] 96% 233/242 [03:33<00:06,  1.45it/s] 97% 234/242 [03:33<00:05,  1.45it/s] 97% 235/242 [03:34<00:04,  1.45it/s] 98% 236/242 [03:35<00:04,  1.46it/s] 98% 237/242 [03:35<00:03,  1.46it/s] 98% 238/242 [03:36<00:02,  1.46it/s] 99% 239/242 [03:37<00:02,  1.46it/s] 99% 240/242 [03:37<00:01,  1.46it/s]100% 241/242 [03:38<00:00,  1.46it/s]100% 242/242 [03:39<00:00,  1.46it/s]{'eval_loss': 2.9191739559173584, 'eval_rouge1': 0.6356, 'eval_rouge2': 0.4659, 'eval_rougeL': 0.5965, 'eval_rougeLsum': 0.5959, 'eval_bert_score': 0.9305, 'eval_sari': 35.9379, 'eval_gen_len': 19.5873, 'eval_runtime': 46.698, 'eval_samples_per_second': 1.349, 'eval_steps_per_second': 0.685, 'epoch': 1.0}

  0% 0/32 [00:00<?, ?it/s][A
  6% 2/32 [00:00<00:11,  2.53it/s][A
  9% 3/32 [00:01<00:15,  1.91it/s][A
 12% 4/32 [00:02<00:17,  1.61it/s][A
 16% 5/32 [00:03<00:18,  1.46it/s][A
 19% 6/32 [00:03<00:18,  1.39it/s][A
 22% 7/32 [00:04<00:18,  1.36it/s][A
 25% 8/32 [00:05<00:18,  1.33it/s][A
 28% 9/32 [00:06<00:17,  1.32it/s][A
 31% 10/32 [00:06<00:16,  1.31it/s][A
 34% 11/32 [00:07<00:16,  1.31it/s][A
 38% 12/32 [00:08<00:15,  1.30it/s][A
 41% 13/32 [00:09<00:14,  1.29it/s][A
 44% 14/32 [00:10<00:14,  1.28it/s][A
 47% 15/32 [00:10<00:13,  1.27it/s][A
 50% 16/32 [00:11<00:12,  1.30it/s][A
 53% 17/32 [00:12<00:11,  1.32it/s][A
 56% 18/32 [00:13<00:10,  1.32it/s][A
 59% 19/32 [00:13<00:09,  1.32it/s][A
 62% 20/32 [00:14<00:09,  1.32it/s][A
 66% 21/32 [00:15<00:08,  1.31it/s][A
 69% 22/32 [00:16<00:07,  1.29it/s][A
 72% 23/32 [00:17<00:07,  1.28it/s][A
 75% 24/32 [00:17<00:06,  1.22it/s][A
 78% 25/32 [00:18<00:05,  1.23it/s][A
 81% 26/32 [00:19<00:04,  1.25it/s][A
 84% 27/32 [00:20<00:03,  1.26it/s][A
 88% 28/32 [00:21<00:03,  1.26it/s][A
 91% 29/32 [00:21<00:02,  1.26it/s][A
 94% 30/32 [00:22<00:01,  1.27it/s][A
 97% 31/32 [00:23<00:00,  1.28it/s][A
100% 32/32 [00:23<00:00,  1.43it/s][A
                                   [A100% 242/242 [04:04<00:00,  1.46it/s]
100% 32/32 [00:24<00:00,  1.43it/s][A
                                   [A                                     100% 242/242 [04:04<00:00,  1.46it/s]100% 242/242 [04:04<00:00,  1.01s/it]
{'eval_loss': 2.0736851692199707, 'eval_rouge1': 0.6498, 'eval_rouge2': 0.4808, 'eval_rougeL': 0.6063, 'eval_rougeLsum': 0.6068, 'eval_bert_score': 0.9327, 'eval_sari': 38.8174, 'eval_gen_len': 19.5079, 'eval_runtime': 25.4743, 'eval_samples_per_second': 2.473, 'eval_steps_per_second': 1.256, 'epoch': 2.0}
{'train_runtime': 250.7204, 'train_samples_per_second': 1.93, 'train_steps_per_second': 0.965, 'train_loss': 3.886935651794938, 'epoch': 2.0}
  0% 0/32 [00:00<?, ?it/s]  6% 2/32 [00:00<00:11,  2.52it/s]  9% 3/32 [00:01<00:15,  1.93it/s] 12% 4/32 [00:02<00:17,  1.62it/s] 16% 5/32 [00:03<00:18,  1.48it/s] 19% 6/32 [00:03<00:18,  1.41it/s] 22% 7/32 [00:04<00:18,  1.37it/s] 25% 8/32 [00:05<00:17,  1.35it/s] 28% 9/32 [00:06<00:17,  1.33it/s] 31% 10/32 [00:06<00:16,  1.31it/s] 34% 11/32 [00:07<00:16,  1.30it/s] 38% 12/32 [00:08<00:15,  1.28it/s] 41% 13/32 [00:09<00:14,  1.28it/s] 44% 14/32 [00:10<00:14,  1.28it/s] 47% 15/32 [00:10<00:13,  1.27it/s] 50% 16/32 [00:11<00:12,  1.28it/s] 53% 17/32 [00:12<00:11,  1.28it/s] 56% 18/32 [00:13<00:10,  1.29it/s] 59% 19/32 [00:13<00:10,  1.28it/s] 62% 20/32 [00:14<00:09,  1.27it/s] 66% 21/32 [00:15<00:08,  1.28it/s] 69% 22/32 [00:16<00:07,  1.29it/s] 72% 23/32 [00:17<00:07,  1.28it/s] 75% 24/32 [00:17<00:06,  1.28it/s] 78% 25/32 [00:18<00:05,  1.27it/s] 81% 26/32 [00:19<00:04,  1.27it/s] 84% 27/32 [00:20<00:03,  1.28it/s] 88% 28/32 [00:21<00:03,  1.27it/s] 91% 29/32 [00:21<00:02,  1.27it/s] 94% 30/32 [00:22<00:01,  1.28it/s] 97% 31/32 [00:23<00:00,  1.27it/s]100% 32/32 [00:23<00:00,  1.44it/s]100% 32/32 [00:24<00:00,  1.30it/s]
wandb: Waiting for W&B process to finish, PID 3452678... (success).
wandb: - 0.00MB of 0.00MB uploaded (0.00MB deduped)wandb: \ 0.00MB of 0.00MB uploaded (0.00MB deduped)wandb: | 0.00MB of 0.00MB uploaded (0.00MB deduped)wandb: / 0.00MB of 0.01MB uploaded (0.00MB deduped)wandb: - 0.00MB of 0.02MB uploaded (0.00MB deduped)wandb: \ 0.01MB of 0.02MB uploaded (0.00MB deduped)wandb: | 0.01MB of 0.02MB uploaded (0.00MB deduped)wandb: / 0.01MB of 0.02MB uploaded (0.00MB deduped)wandb: - 0.01MB of 0.02MB uploaded (0.00MB deduped)wandb: \ 0.01MB of 0.02MB uploaded (0.00MB deduped)wandb: | 0.01MB of 0.02MB uploaded (0.00MB deduped)wandb: / 0.01MB of 0.02MB uploaded (0.00MB deduped)wandb: - 0.01MB of 0.02MB uploaded (0.00MB deduped)wandb: \ 0.01MB of 0.02MB uploaded (0.00MB deduped)wandb: | 0.01MB of 0.02MB uploaded (0.00MB deduped)wandb: / 0.02MB of 0.02MB uploaded (0.00MB deduped)wandb: - 0.02MB of 0.02MB uploaded (0.00MB deduped)wandb: \ 0.02MB of 0.02MB uploaded (0.00MB deduped)wandb: | 0.02MB of 0.02MB uploaded (0.00MB deduped)wandb: / 0.02MB of 0.02MB uploaded (0.00MB deduped)wandb: - 0.02MB of 0.02MB uploaded (0.00MB deduped)wandb: \ 0.02MB of 0.02MB uploaded (0.00MB deduped)wandb: | 0.02MB of 0.02MB uploaded (0.00MB deduped)wandb: / 0.02MB of 0.02MB uploaded (0.00MB deduped)wandb: - 0.02MB of 0.02MB uploaded (0.00MB deduped)wandb: \ 0.02MB of 0.02MB uploaded (0.00MB deduped)wandb:
wandb: Run history:
wandb:                  eval/bert_score ▁██
wandb:                     eval/gen_len █▁▁
wandb:                        eval/loss █▁▁
wandb:                      eval/rouge1 ▁██
wandb:                      eval/rouge2 ▁██
wandb:                      eval/rougeL ▁██
wandb:                   eval/rougeLsum ▁██
wandb:                     eval/runtime █▁▁
wandb:          eval/samples_per_second ▁██
wandb:                        eval/sari ▁██
wandb:            eval/steps_per_second ▁██
wandb:                      train/epoch ▁███
wandb:                train/global_step ▁███
wandb:                 train/total_flos ▁
wandb:                 train/train_loss ▁
wandb:              train/train_runtime ▁
wandb:   train/train_samples_per_second ▁
wandb:     train/train_steps_per_second ▁
wandb:
wandb: Run summary:
wandb:                  eval/bert_score 0.9327
wandb:                     eval/gen_len 19.5079
wandb:                        eval/loss 2.07369
wandb:                      eval/rouge1 0.6498
wandb:                      eval/rouge2 0.4808
wandb:                      eval/rougeL 0.6063
wandb:                   eval/rougeLsum 0.6068
wandb:                     eval/runtime 25.4878
wandb:          eval/samples_per_second 2.472
wandb:                        eval/sari 38.8174
wandb:            eval/steps_per_second 1.256
wandb:                      train/epoch 2.0
wandb:                train/global_step 242
wandb:                 train/total_flos 65554914213888.0
wandb:                 train/train_loss 3.88694
wandb:              train/train_runtime 250.7204
wandb:   train/train_samples_per_second 1.93
wandb:     train/train_steps_per_second 0.965
wandb:
wandb: Synced 6 W&B file(s), 0 media file(s), 0 artifact file(s) and 0 other file(s)
wandb: Synced pious-glitter-48: https://wandb.ai/ljyflores_team/huggingface/runs/29zo1g9f
wandb: Find logs at: ./wandb/run-20230309_142135-29zo1g9f/logs/debug.log
wandb:
