Using custom data configuration default-45263a531a701e55
Reusing dataset json (/home/lily/lyf6/.cache/huggingface/datasets/json/default-45263a531a701e55/0.0.0/ac0ca5f5289a6cf108e706efcf040422dbbfa8e658dee6a819f20d76bb84d26b)
Using dataset: testfile, Args: 7e-5 (lr), 10 (epochs), 4 (batch_size)
  0%|          | 0/1 [00:00<?, ?it/s]100%|██████████| 1/1 [00:00<00:00, 424.52it/s]
Using custom data configuration default-d9d706ff46131c58
Reusing dataset json (/home/lily/lyf6/.cache/huggingface/datasets/json/default-d9d706ff46131c58/0.0.0/ac0ca5f5289a6cf108e706efcf040422dbbfa8e658dee6a819f20d76bb84d26b)
  0%|          | 0/1 [00:00<?, ?it/s]100%|██████████| 1/1 [00:00<00:00, 545.64it/s]
Loading cached processed dataset at /home/lily/lyf6/.cache/huggingface/datasets/json/default-45263a531a701e55/0.0.0/ac0ca5f5289a6cf108e706efcf040422dbbfa8e658dee6a819f20d76bb84d26b/cache-755e6e319c262889.arrow
Loading cached processed dataset at /home/lily/lyf6/.cache/huggingface/datasets/json/default-d9d706ff46131c58/0.0.0/ac0ca5f5289a6cf108e706efcf040422dbbfa8e658dee6a819f20d76bb84d26b/cache-8317bcd127d3d5d3.arrow
/home/lily/lyf6/miniconda3/envs/simplification/lib/python3.8/site-packages/transformers/optimization.py:346: FutureWarning: This implementation of AdamW is deprecated and will be removed in a future version. Use the PyTorch implementation torch.optim.AdamW instead, or set `no_deprecation_warning=True` to disable this warning
  warnings.warn(
wandb: Currently logged in as: ljyflores_team (use `wandb login --relogin` to force relogin)
wandb: wandb version 0.13.11 is available!  To upgrade, please run:
wandb:  $ pip install wandb --upgrade
wandb: Tracking run with wandb version 0.12.9
wandb: Syncing run breezy-firefly-55
wandb:  View project at https://wandb.ai/ljyflores_team/huggingface
wandb:  View run at https://wandb.ai/ljyflores_team/huggingface/runs/puhqkygb
wandb: Run data is saved locally in /data/lily/lyf6/Simplification-Project/wandb/run-20230312_160539-puhqkygb
wandb: Run `wandb offline` to turn off syncing.
  0% 0/310 [00:00<?, ?it/s]
/home/lily/lyf6/miniconda3/envs/simplification/lib/python3.8/site-packages/torch/nn/parallel/_functions.py:68: UserWarning: Was asked to gather along dimension 0, but all input tensors were scalars; will instead unsqueeze and return a vector.
  warnings.warn('Was asked to gather along dimension 0, but all '
  0% 1/310 [00:04<24:46,  4.81s/it]  1% 2/310 [00:05<12:05,  2.36s/it]  1% 3/310 [00:06<08:01,  1.57s/it]  1% 4/310 [00:06<06:23,  1.25s/it]  2% 5/310 [00:07<05:20,  1.05s/it]  2% 6/310 [00:08<04:42,  1.08it/s]  2% 7/310 [00:08<04:17,  1.18it/s]  3% 8/310 [00:09<04:01,  1.25it/s]  3% 9/310 [00:10<03:51,  1.30it/s]  3% 10/310 [00:10<03:42,  1.35it/s]  4% 11/310 [00:11<03:36,  1.38it/s]  4% 12/310 [00:12<03:33,  1.39it/s]  4% 13/310 [00:13<03:30,  1.41it/s]  5% 14/310 [00:13<03:27,  1.42it/s]  5% 15/310 [00:14<03:24,  1.44it/s]  5% 16/310 [00:15<03:22,  1.45it/s]  5% 17/310 [00:15<03:22,  1.45it/s]  6% 18/310 [00:16<03:21,  1.45it/s]  6% 19/310 [00:17<03:22,  1.44it/s]  6% 20/310 [00:17<03:21,  1.44it/s]  7% 21/310 [00:18<03:20,  1.44it/s]  7% 22/310 [00:19<03:19,  1.45it/s]  7% 23/310 [00:19<03:17,  1.45it/s]  8% 24/310 [00:20<03:17,  1.45it/s]  8% 25/310 [00:21<03:16,  1.45it/s]  8% 26/310 [00:22<03:14,  1.46it/s]  9% 27/310 [00:22<03:15,  1.44it/s]  9% 28/310 [00:23<03:15,  1.45it/s]  9% 29/310 [00:24<03:17,  1.42it/s] 10% 30/310 [00:24<03:14,  1.44it/s] 10% 31/310 [00:25<03:12,  1.45it/s]
  0% 0/2 [00:00<?, ?it/s][A
100% 2/2 [00:01<00:00,  1.61it/s][A                                    
                                 [A 10% 31/310 [00:37<03:12,  1.45it/s]
100% 2/2 [00:10<00:00,  1.61it/s][A
                                 [A 10% 32/310 [00:38<19:48,  4.28s/it] 11% 33/310 [00:38<14:46,  3.20s/it] 11% 34/310 [00:39<11:15,  2.45s/it] 11% 35/310 [00:40<08:47,  1.92s/it] 12% 36/310 [00:40<07:03,  1.54s/it] 12% 37/310 [00:41<05:50,  1.28s/it] 12% 38/310 [00:42<04:58,  1.10s/it] 13% 39/310 [00:42<04:24,  1.02it/s] 13% 40/310 [00:43<04:00,  1.12it/s] 13% 41/310 [00:44<03:42,  1.21it/s] 14% 42/310 [00:44<03:29,  1.28it/s] 14% 43/310 [00:45<03:20,  1.33it/s] 14% 44/310 [00:46<03:13,  1.38it/s] 15% 45/310 [00:46<03:09,  1.40it/s] 15% 46/310 [00:47<03:07,  1.40it/s] 15% 47/310 [00:48<03:06,  1.41it/s] 15% 48/310 [00:49<03:03,  1.43it/s] 16% 49/310 [00:49<03:02,  1.43it/s] 16% 50/310 [00:50<03:00,  1.44it/s] 16% 51/310 [00:51<02:57,  1.46it/s] 17% 52/310 [00:51<02:56,  1.46it/s] 17% 53/310 [00:52<02:55,  1.47it/s] 17% 54/310 [00:53<02:54,  1.47it/s] 18% 55/310 [00:53<02:54,  1.46it/s] 18% 56/310 [00:54<02:53,  1.47it/s] 18% 57/310 [00:55<02:53,  1.46it/s] 19% 58/310 [00:55<02:52,  1.46it/s] 19% 59/310 [00:56<02:51,  1.47it/s] 19% 60/310 [00:57<02:49,  1.47it/s] 20% 61/310 [00:57<02:48,  1.47it/s] 20% 62/310 [00:58<02:49,  1.47it/s]
{'eval_loss': 3.339139223098755, 'eval_rouge1': 0.6431, 'eval_rouge2': 0.4758, 'eval_rougeL': 0.6023, 'eval_rougeLsum': 0.6046, 'eval_bert_score': 0.9297, 'eval_sari': 38.6423, 'eval_gen_len': 19.127, 'eval_runtime': 11.913, 'eval_samples_per_second': 5.288, 'eval_steps_per_second': 0.168, 'epoch': 1.0}
  0% 0/2 [00:00<?, ?it/s][A
100% 2/2 [00:01<00:00,  1.43it/s][A                                    
                                 [A 20% 62/310 [01:02<02:49,  1.47it/s]
100% 2/2 [00:02<00:00,  1.43it/s][A
                                 [A 20% 63/310 [01:02<07:03,  1.71s/it] 21% 64/310 [01:03<05:44,  1.40s/it] 21% 65/310 [01:04<04:49,  1.18s/it] 21% 66/310 [01:04<04:10,  1.03s/it] 22% 67/310 [01:05<03:45,  1.08it/s] 22% 68/310 [01:06<03:26,  1.17it/s] 22% 69/310 [01:06<03:13,  1.25it/s] 23% 70/310 [01:07<03:03,  1.31it/s] 23% 71/310 [01:08<02:56,  1.35it/s] 23% 72/310 [01:08<02:52,  1.38it/s] 24% 73/310 [01:09<02:49,  1.40it/s] 24% 74/310 [01:10<02:46,  1.42it/s] 24% 75/310 [01:10<02:43,  1.43it/s] 25% 76/310 [01:11<02:43,  1.43it/s] 25% 77/310 [01:12<02:41,  1.44it/s] 25% 78/310 [01:12<02:40,  1.45it/s] 25% 79/310 [01:13<02:39,  1.45it/s] 26% 80/310 [01:14<02:38,  1.45it/s] 26% 81/310 [01:15<02:37,  1.45it/s] 26% 82/310 [01:15<02:36,  1.46it/s] 27% 83/310 [01:16<02:35,  1.46it/s] 27% 84/310 [01:17<02:35,  1.45it/s] 27% 85/310 [01:17<02:36,  1.44it/s] 28% 86/310 [01:18<02:35,  1.44it/s] 28% 87/310 [01:19<02:34,  1.45it/s] 28% 88/310 [01:19<02:34,  1.44it/s] 29% 89/310 [01:20<02:33,  1.44it/s] 29% 90/310 [01:21<02:33,  1.43it/s] 29% 91/310 [01:21<02:32,  1.44it/s] 30% 92/310 [01:22<02:31,  1.44it/s] 30% 93/310 [01:23<02:31,  1.44it/s]{'eval_loss': 1.3366830348968506, 'eval_rouge1': 0.6335, 'eval_rouge2': 0.4645, 'eval_rougeL': 0.5923, 'eval_rougeLsum': 0.5936, 'eval_bert_score': 0.9294, 'eval_sari': 35.2508, 'eval_gen_len': 19.5556, 'eval_runtime': 3.4165, 'eval_samples_per_second': 18.44, 'eval_steps_per_second': 0.585, 'epoch': 2.0}

  0% 0/2 [00:00<?, ?it/s][A
100% 2/2 [00:01<00:00,  1.62it/s][A                                    
                                 [A 30% 93/310 [01:26<02:31,  1.44it/s]
100% 2/2 [00:01<00:00,  1.62it/s][A
                                 [A 30% 94/310 [01:27<06:08,  1.71s/it] 31% 95/310 [01:28<05:01,  1.40s/it] 31% 96/310 [01:28<04:14,  1.19s/it] 31% 97/310 [01:29<03:40,  1.04s/it] 32% 98/310 [01:30<03:18,  1.07it/s] 32% 99/310 [01:30<03:01,  1.16it/s] 32% 100/310 [01:31<02:49,  1.24it/s] 33% 101/310 [01:32<02:41,  1.29it/s] 33% 102/310 [01:33<02:44,  1.26it/s] 33% 103/310 [01:33<02:36,  1.32it/s] 34% 104/310 [01:34<02:32,  1.35it/s] 34% 105/310 [01:35<02:27,  1.39it/s] 34% 106/310 [01:35<02:25,  1.40it/s] 35% 107/310 [01:36<02:23,  1.41it/s] 35% 108/310 [01:37<02:21,  1.43it/s] 35% 109/310 [01:37<02:19,  1.44it/s] 35% 110/310 [01:38<02:18,  1.44it/s] 36% 111/310 [01:39<02:17,  1.45it/s] 36% 112/310 [01:39<02:16,  1.45it/s] 36% 113/310 [01:40<02:14,  1.47it/s] 37% 114/310 [01:41<02:14,  1.46it/s] 37% 115/310 [01:42<02:14,  1.45it/s] 37% 116/310 [01:42<02:12,  1.46it/s] 38% 117/310 [01:43<02:11,  1.47it/s] 38% 118/310 [01:44<02:11,  1.46it/s] 38% 119/310 [01:44<02:10,  1.47it/s] 39% 120/310 [01:45<02:09,  1.47it/s] 39% 121/310 [01:46<02:08,  1.48it/s] 39% 122/310 [01:46<02:07,  1.47it/s] 40% 123/310 [01:47<02:06,  1.47it/s] 40% 124/310 [01:48<02:06,  1.47it/s]
{'eval_loss': 0.636774480342865, 'eval_rouge1': 0.637, 'eval_rouge2': 0.4702, 'eval_rougeL': 0.5978, 'eval_rougeLsum': 0.5987, 'eval_bert_score': 0.9325, 'eval_sari': 36.7857, 'eval_gen_len': 19.3175, 'eval_runtime': 3.3355, 'eval_samples_per_second': 18.888, 'eval_steps_per_second': 0.6, 'epoch': 3.0}
  0% 0/2 [00:00<?, ?it/s][A
100% 2/2 [00:01<00:00,  1.65it/s][A                                     
                                 [A 40% 124/310 [01:51<02:06,  1.47it/s]
100% 2/2 [00:01<00:00,  1.65it/s][A
                                 [A 40% 125/310 [01:52<05:06,  1.66s/it] 41% 126/310 [01:52<04:11,  1.37s/it] 41% 127/310 [01:53<03:32,  1.16s/it] 41% 128/310 [01:54<03:04,  1.02s/it] 42% 129/310 [01:54<02:45,  1.10it/s] 42% 130/310 [01:55<02:32,  1.18it/s] 42% 131/310 [01:56<02:23,  1.25it/s] 43% 132/310 [01:56<02:16,  1.31it/s] 43% 133/310 [01:57<02:11,  1.35it/s] 43% 134/310 [01:58<02:08,  1.37it/s] 44% 135/310 [01:58<02:04,  1.40it/s] 44% 136/310 [01:59<02:02,  1.42it/s] 44% 137/310 [02:00<02:00,  1.44it/s] 45% 138/310 [02:00<01:58,  1.45it/s] 45% 139/310 [02:01<01:58,  1.44it/s] 45% 140/310 [02:02<01:57,  1.45it/s] 45% 141/310 [02:03<01:56,  1.46it/s] 46% 142/310 [02:03<01:55,  1.45it/s] 46% 143/310 [02:04<01:54,  1.46it/s] 46% 144/310 [02:05<01:53,  1.46it/s] 47% 145/310 [02:05<01:52,  1.47it/s] 47% 146/310 [02:06<01:52,  1.46it/s] 47% 147/310 [02:07<01:51,  1.46it/s] 48% 148/310 [02:07<01:58,  1.37it/s] 48% 149/310 [02:08<01:56,  1.38it/s] 48% 150/310 [02:09<01:54,  1.40it/s] 49% 151/310 [02:10<01:51,  1.42it/s] 49% 152/310 [02:10<01:50,  1.43it/s] 49% 153/310 [02:11<01:48,  1.44it/s] 50% 154/310 [02:12<01:47,  1.45it/s] 50% 155/310 [02:12<01:46,  1.46it/s]{'eval_loss': 0.5936243534088135, 'eval_rouge1': 0.6593, 'eval_rouge2': 0.4876, 'eval_rougeL': 0.6173, 'eval_rougeLsum': 0.6178, 'eval_bert_score': 0.9333, 'eval_sari': 39.5059, 'eval_gen_len': 18.8413, 'eval_runtime': 3.2079, 'eval_samples_per_second': 19.639, 'eval_steps_per_second': 0.623, 'epoch': 4.0}

  0% 0/2 [00:00<?, ?it/s][A
100% 2/2 [00:01<00:00,  1.58it/s][A                                     
                                 [A 50% 155/310 [02:16<01:46,  1.46it/s]
100% 2/2 [00:02<00:00,  1.58it/s][A
                                 [A 50% 156/310 [02:16<04:19,  1.69s/it] 51% 157/310 [02:17<03:33,  1.40s/it] 51% 158/310 [02:18<02:59,  1.18s/it] 51% 159/310 [02:18<02:36,  1.04s/it] 52% 160/310 [02:19<02:20,  1.07it/s] 52% 161/310 [02:20<02:08,  1.16it/s] 52% 162/310 [02:20<01:59,  1.23it/s] 53% 163/310 [02:21<01:53,  1.29it/s] 53% 164/310 [02:22<01:48,  1.34it/s] 53% 165/310 [02:22<01:45,  1.38it/s] 54% 166/310 [02:23<01:42,  1.40it/s] 54% 167/310 [02:24<01:41,  1.40it/s] 54% 168/310 [02:25<01:40,  1.42it/s] 55% 169/310 [02:25<01:38,  1.43it/s] 55% 170/310 [02:26<01:37,  1.43it/s] 55% 171/310 [02:27<01:36,  1.44it/s] 55% 172/310 [02:27<01:35,  1.45it/s] 56% 173/310 [02:28<01:34,  1.46it/s] 56% 174/310 [02:29<01:32,  1.46it/s] 56% 175/310 [02:29<01:32,  1.46it/s] 57% 176/310 [02:30<01:31,  1.46it/s] 57% 177/310 [02:31<01:31,  1.45it/s] 57% 178/310 [02:31<01:30,  1.46it/s] 58% 179/310 [02:32<01:30,  1.45it/s] 58% 180/310 [02:33<01:29,  1.45it/s] 58% 181/310 [02:34<01:28,  1.45it/s] 59% 182/310 [02:34<01:27,  1.46it/s] 59% 183/310 [02:35<01:26,  1.46it/s] 59% 184/310 [02:36<01:25,  1.47it/s] 60% 185/310 [02:36<01:25,  1.46it/s] 60% 186/310 [02:37<01:25,  1.45it/s]{'eval_loss': 0.5913999080657959, 'eval_rouge1': 0.6565, 'eval_rouge2': 0.4836, 'eval_rougeL': 0.6182, 'eval_rougeLsum': 0.6185, 'eval_bert_score': 0.9345, 'eval_sari': 39.0917, 'eval_gen_len': 19.4762, 'eval_runtime': 3.3142, 'eval_samples_per_second': 19.009, 'eval_steps_per_second': 0.603, 'epoch': 5.0}

  0% 0/2 [00:00<?, ?it/s][A
100% 2/2 [00:01<00:00,  1.43it/s][A                                     
                                 [A 60% 186/310 [02:40<01:25,  1.45it/s]
100% 2/2 [00:02<00:00,  1.43it/s][A
                                 [A 60% 187/310 [02:41<03:35,  1.75s/it] 61% 188/310 [02:42<02:56,  1.44s/it] 61% 189/310 [02:43<02:28,  1.23s/it] 61% 190/310 [02:43<02:08,  1.07s/it] 62% 191/310 [02:44<01:53,  1.05it/s] 62% 192/310 [02:45<01:43,  1.14it/s] 62% 193/310 [02:45<01:35,  1.22it/s] 63% 194/310 [02:46<01:30,  1.28it/s] 63% 195/310 [02:47<01:27,  1.32it/s] 63% 196/310 [02:47<01:24,  1.35it/s] 64% 197/310 [02:48<01:22,  1.38it/s] 64% 198/310 [02:49<01:20,  1.40it/s] 64% 199/310 [02:50<01:18,  1.41it/s] 65% 200/310 [02:50<01:17,  1.43it/s] 65% 201/310 [02:51<01:15,  1.44it/s] 65% 202/310 [02:52<01:15,  1.44it/s] 65% 203/310 [02:52<01:13,  1.45it/s] 66% 204/310 [02:53<01:12,  1.45it/s] 66% 205/310 [02:54<01:11,  1.46it/s] 66% 206/310 [02:54<01:11,  1.46it/s] 67% 207/310 [02:55<01:10,  1.46it/s] 67% 208/310 [02:56<01:09,  1.46it/s] 67% 209/310 [02:56<01:10,  1.44it/s] 68% 210/310 [02:57<01:10,  1.43it/s] 68% 211/310 [02:58<01:09,  1.42it/s] 68% 212/310 [02:59<01:08,  1.43it/s] 69% 213/310 [02:59<01:07,  1.43it/s] 69% 214/310 [03:00<01:06,  1.44it/s] 69% 215/310 [03:01<01:05,  1.44it/s] 70% 216/310 [03:01<01:04,  1.45it/s] 70% 217/310 [03:02<01:03,  1.45it/s]
{'eval_loss': 0.6061379909515381, 'eval_rouge1': 0.6658, 'eval_rouge2': 0.4924, 'eval_rougeL': 0.6239, 'eval_rougeLsum': 0.6261, 'eval_bert_score': 0.9342, 'eval_sari': 40.6491, 'eval_gen_len': 19.1429, 'eval_runtime': 3.5065, 'eval_samples_per_second': 17.967, 'eval_steps_per_second': 0.57, 'epoch': 6.0}
  0% 0/2 [00:00<?, ?it/s][A
100% 2/2 [00:01<00:00,  1.62it/s][A                                     
                                 [A 70% 217/310 [03:05<01:03,  1.45it/s]
100% 2/2 [00:02<00:00,  1.62it/s][A
                                 [A 70% 218/310 [03:06<02:34,  1.68s/it] 71% 219/310 [03:07<02:05,  1.38s/it] 71% 220/310 [03:07<01:45,  1.17s/it] 71% 221/310 [03:08<01:31,  1.02s/it] 72% 222/310 [03:09<01:21,  1.08it/s] 72% 223/310 [03:09<01:14,  1.17it/s] 72% 224/310 [03:10<01:08,  1.25it/s] 73% 225/310 [03:11<01:05,  1.30it/s] 73% 226/310 [03:11<01:02,  1.35it/s] 73% 227/310 [03:12<01:00,  1.38it/s] 74% 228/310 [03:13<00:58,  1.41it/s] 74% 229/310 [03:14<01:00,  1.35it/s] 74% 230/310 [03:14<00:58,  1.38it/s] 75% 231/310 [03:15<00:56,  1.40it/s] 75% 232/310 [03:16<00:55,  1.41it/s] 75% 233/310 [03:16<00:54,  1.42it/s] 75% 234/310 [03:17<00:53,  1.43it/s] 76% 235/310 [03:18<00:52,  1.43it/s] 76% 236/310 [03:18<00:51,  1.44it/s] 76% 237/310 [03:19<00:50,  1.44it/s] 77% 238/310 [03:20<00:49,  1.45it/s] 77% 239/310 [03:20<00:48,  1.45it/s] 77% 240/310 [03:21<00:47,  1.46it/s] 78% 241/310 [03:22<00:47,  1.45it/s] 78% 242/310 [03:23<00:47,  1.45it/s] 78% 243/310 [03:23<00:46,  1.45it/s] 79% 244/310 [03:24<00:45,  1.46it/s] 79% 245/310 [03:25<00:44,  1.46it/s] 79% 246/310 [03:25<00:43,  1.46it/s] 80% 247/310 [03:26<00:42,  1.47it/s] 80% 248/310 [03:27<00:42,  1.46it/s]{'eval_loss': 0.6333694458007812, 'eval_rouge1': 0.6624, 'eval_rouge2': 0.4869, 'eval_rougeL': 0.623, 'eval_rougeLsum': 0.6258, 'eval_bert_score': 0.9337, 'eval_sari': 39.7859, 'eval_gen_len': 18.9683, 'eval_runtime': 3.281, 'eval_samples_per_second': 19.201, 'eval_steps_per_second': 0.61, 'epoch': 7.0}

  0% 0/2 [00:00<?, ?it/s][A
100% 2/2 [00:01<00:00,  1.62it/s][A                                     
                                 [A 80% 248/310 [03:30<00:42,  1.46it/s]
100% 2/2 [00:02<00:00,  1.62it/s][A
                                 [A 80% 249/310 [03:31<01:42,  1.68s/it] 81% 250/310 [03:31<01:23,  1.39s/it] 81% 251/310 [03:32<01:09,  1.18s/it] 81% 252/310 [03:33<00:59,  1.03s/it] 82% 253/310 [03:33<00:52,  1.08it/s] 82% 254/310 [03:34<00:47,  1.17it/s] 82% 255/310 [03:35<00:44,  1.23it/s] 83% 256/310 [03:36<00:42,  1.28it/s] 83% 257/310 [03:36<00:40,  1.32it/s] 83% 258/310 [03:37<00:38,  1.36it/s] 84% 259/310 [03:38<00:36,  1.39it/s] 84% 260/310 [03:38<00:35,  1.41it/s] 84% 261/310 [03:39<00:37,  1.31it/s] 85% 262/310 [03:40<00:35,  1.35it/s] 85% 263/310 [03:41<00:33,  1.39it/s] 85% 264/310 [03:41<00:32,  1.40it/s] 85% 265/310 [03:42<00:31,  1.41it/s] 86% 266/310 [03:43<00:30,  1.43it/s] 86% 267/310 [03:43<00:29,  1.44it/s] 86% 268/310 [03:44<00:28,  1.45it/s] 87% 269/310 [03:45<00:28,  1.46it/s] 87% 270/310 [03:45<00:27,  1.46it/s] 87% 271/310 [03:46<00:26,  1.46it/s] 88% 272/310 [03:47<00:26,  1.46it/s] 88% 273/310 [03:47<00:25,  1.46it/s] 88% 274/310 [03:48<00:24,  1.46it/s] 89% 275/310 [03:49<00:23,  1.47it/s] 89% 276/310 [03:49<00:23,  1.46it/s] 89% 277/310 [03:50<00:22,  1.47it/s] 90% 278/310 [03:51<00:21,  1.47it/s] 90% 279/310 [03:51<00:21,  1.47it/s]
{'eval_loss': 0.6637908816337585, 'eval_rouge1': 0.6595, 'eval_rouge2': 0.4831, 'eval_rougeL': 0.6196, 'eval_rougeLsum': 0.6216, 'eval_bert_score': 0.9337, 'eval_sari': 39.3959, 'eval_gen_len': 19.0635, 'eval_runtime': 3.279, 'eval_samples_per_second': 19.213, 'eval_steps_per_second': 0.61, 'epoch': 8.0}
  0% 0/2 [00:00<?, ?it/s][A
100% 2/2 [00:01<00:00,  1.62it/s][A                                     
                                 [A 90% 279/310 [03:55<00:21,  1.47it/s]
100% 2/2 [00:02<00:00,  1.62it/s][A
                                 [A 90% 280/310 [03:56<00:50,  1.70s/it] 91% 281/310 [03:56<00:40,  1.39s/it] 91% 282/310 [03:57<00:33,  1.18s/it] 91% 283/310 [03:58<00:27,  1.04s/it] 92% 284/310 [03:58<00:24,  1.07it/s] 92% 285/310 [03:59<00:21,  1.16it/s] 92% 286/310 [04:00<00:19,  1.24it/s] 93% 287/310 [04:00<00:17,  1.30it/s] 93% 288/310 [04:01<00:16,  1.34it/s] 93% 289/310 [04:02<00:15,  1.37it/s] 94% 290/310 [04:02<00:14,  1.40it/s] 94% 291/310 [04:03<00:13,  1.43it/s] 94% 292/310 [04:04<00:12,  1.43it/s] 95% 293/310 [04:04<00:11,  1.43it/s] 95% 294/310 [04:05<00:11,  1.43it/s] 95% 295/310 [04:06<00:10,  1.44it/s] 95% 296/310 [04:07<00:09,  1.45it/s] 96% 297/310 [04:07<00:08,  1.45it/s] 96% 298/310 [04:08<00:08,  1.45it/s] 96% 299/310 [04:09<00:07,  1.46it/s] 97% 300/310 [04:09<00:06,  1.45it/s] 97% 301/310 [04:10<00:06,  1.46it/s] 97% 302/310 [04:11<00:05,  1.45it/s] 98% 303/310 [04:11<00:04,  1.45it/s] 98% 304/310 [04:12<00:04,  1.46it/s] 98% 305/310 [04:13<00:03,  1.47it/s] 99% 306/310 [04:14<00:02,  1.39it/s] 99% 307/310 [04:14<00:02,  1.42it/s] 99% 308/310 [04:15<00:01,  1.44it/s]100% 309/310 [04:16<00:00,  1.45it/s]100% 310/310 [04:16<00:00,  1.45it/s]{'eval_loss': 0.6408765316009521, 'eval_rouge1': 0.6572, 'eval_rouge2': 0.479, 'eval_rougeL': 0.6149, 'eval_rougeLsum': 0.6162, 'eval_bert_score': 0.9324, 'eval_sari': 38.7227, 'eval_gen_len': 19.0635, 'eval_runtime': 3.3394, 'eval_samples_per_second': 18.866, 'eval_steps_per_second': 0.599, 'epoch': 9.0}

  0% 0/2 [00:00<?, ?it/s][A
100% 2/2 [00:01<00:00,  1.61it/s][A                                     
                                 [A100% 310/310 [04:20<00:00,  1.45it/s]
100% 2/2 [00:02<00:00,  1.61it/s][A
                                 [A                                     100% 310/310 [04:20<00:00,  1.45it/s]100% 310/310 [04:20<00:00,  1.19it/s]
{'eval_loss': 0.6838762760162354, 'eval_rouge1': 0.6499, 'eval_rouge2': 0.4795, 'eval_rougeL': 0.6121, 'eval_rougeLsum': 0.6122, 'eval_bert_score': 0.9322, 'eval_sari': 38.1587, 'eval_gen_len': 19.4603, 'eval_runtime': 3.3108, 'eval_samples_per_second': 19.029, 'eval_steps_per_second': 0.604, 'epoch': 10.0}
{'train_runtime': 266.4363, 'train_samples_per_second': 9.083, 'train_steps_per_second': 1.164, 'train_loss': 1.0943418441280242, 'epoch': 10.0}
  0% 0/2 [00:00<?, ?it/s]100% 2/2 [00:01<00:00,  1.63it/s]100% 2/2 [00:02<00:00,  1.01s/it]
Done
wandb: Waiting for W&B process to finish, PID 350972... (success).
wandb: - 0.00MB of 0.00MB uploaded (0.00MB deduped)wandb: \ 0.00MB of 0.00MB uploaded (0.00MB deduped)wandb: | 0.00MB of 0.00MB uploaded (0.00MB deduped)wandb: / 0.00MB of 0.02MB uploaded (0.00MB deduped)wandb: - 0.00MB of 0.02MB uploaded (0.00MB deduped)wandb: \ 0.00MB of 0.02MB uploaded (0.00MB deduped)wandb: | 0.00MB of 0.02MB uploaded (0.00MB deduped)wandb: / 0.00MB of 0.02MB uploaded (0.00MB deduped)wandb: - 0.00MB of 0.02MB uploaded (0.00MB deduped)wandb: \ 0.00MB of 0.02MB uploaded (0.00MB deduped)wandb: | 0.00MB of 0.02MB uploaded (0.00MB deduped)wandb: / 0.00MB of 0.02MB uploaded (0.00MB deduped)wandb: - 0.00MB of 0.02MB uploaded (0.00MB deduped)wandb: \ 0.00MB of 0.02MB uploaded (0.00MB deduped)wandb: | 0.00MB of 0.02MB uploaded (0.00MB deduped)wandb: / 0.02MB of 0.02MB uploaded (0.00MB deduped)wandb: - 0.02MB of 0.02MB uploaded (0.00MB deduped)wandb: \ 0.02MB of 0.02MB uploaded (0.00MB deduped)wandb: | 0.02MB of 0.02MB uploaded (0.00MB deduped)wandb: / 0.02MB of 0.02MB uploaded (0.00MB deduped)wandb: - 0.02MB of 0.02MB uploaded (0.00MB deduped)wandb:                                                                                
wandb: Run history:
wandb:                  eval/bert_score ▁▁▅▆██▇▇▅▅
wandb:                     eval/gen_len ▄█▆▁▇▄▂▃▃▇
wandb:                        eval/loss █▃▁▁▁▁▁▁▁▁
wandb:                      eval/rouge1 ▃▁▂▇▆█▇▇▆▅
wandb:                      eval/rouge2 ▄▁▂▇▆█▇▆▅▅
wandb:                      eval/rougeL ▃▁▂▇▇██▇▆▅
wandb:                   eval/rougeLsum ▃▁▂▆▆██▇▆▅
wandb:                     eval/runtime █▁▁▁▁▁▁▁▁▁
wandb:          eval/samples_per_second ▁▇███▇████
wandb:                        eval/sari ▅▁▃▇▆█▇▆▆▅
wandb:            eval/steps_per_second ▁▇███▇████
wandb:                      train/epoch ▁▂▃▃▄▅▆▆▇██
wandb:                train/global_step ▁▂▃▃▄▅▆▆▇██
wandb:                 train/total_flos ▁
wandb:                 train/train_loss ▁
wandb:              train/train_runtime ▁
wandb:   train/train_samples_per_second ▁
wandb:     train/train_steps_per_second ▁
wandb: 
wandb: Run summary:
wandb:                  eval/bert_score 0.9322
wandb:                     eval/gen_len 19.4603
wandb:                        eval/loss 0.68388
wandb:                      eval/rouge1 0.6499
wandb:                      eval/rouge2 0.4795
wandb:                      eval/rougeL 0.6121
wandb:                   eval/rougeLsum 0.6122
wandb:                     eval/runtime 3.3108
wandb:          eval/samples_per_second 19.029
wandb:                        eval/sari 38.1587
wandb:            eval/steps_per_second 0.604
wandb:                      train/epoch 10.0
wandb:                train/global_step 310
wandb:                 train/total_flos 327774571069440.0
wandb:                 train/train_loss 1.09434
wandb:              train/train_runtime 266.4363
wandb:   train/train_samples_per_second 9.083
wandb:     train/train_steps_per_second 1.164
wandb: 
wandb: Synced 6 W&B file(s), 0 media file(s), 0 artifact file(s) and 0 other file(s)
wandb: Synced breezy-firefly-55: https://wandb.ai/ljyflores_team/huggingface/runs/puhqkygb
wandb: Find logs at: ./wandb/run-20230312_160539-puhqkygb/logs/debug.log
wandb: 

