Using custom data configuration default-a76fd4faf6436e13
Reusing dataset json (/home/lily/lyf6/.cache/huggingface/datasets/json/default-a76fd4faf6436e13/0.0.0/ac0ca5f5289a6cf108e706efcf040422dbbfa8e658dee6a819f20d76bb84d26b)
Using dataset: cochrane, Args: 1e-4 (lr), 5 (epochs), 4 (batch_size), None (checkpoint)
  0%|          | 0/1 [00:00<?, ?it/s]100%|██████████| 1/1 [00:00<00:00, 440.30it/s]
Using custom data configuration default-6008f3d38acc97fb
Reusing dataset json (/home/lily/lyf6/.cache/huggingface/datasets/json/default-6008f3d38acc97fb/0.0.0/ac0ca5f5289a6cf108e706efcf040422dbbfa8e658dee6a819f20d76bb84d26b)
  0%|          | 0/1 [00:00<?, ?it/s]100%|██████████| 1/1 [00:00<00:00, 434.87it/s]
  0%|          | 0/4 [00:00<?, ?ba/s] 25%|██▌       | 1/4 [00:05<00:17,  5.70s/ba] 50%|█████     | 2/4 [00:10<00:10,  5.33s/ba] 75%|███████▌  | 3/4 [00:16<00:05,  5.45s/ba]100%|██████████| 4/4 [00:19<00:00,  4.55s/ba]100%|██████████| 4/4 [00:19<00:00,  4.88s/ba]
  0%|          | 0/1 [00:00<?, ?ba/s]100%|██████████| 1/1 [00:02<00:00,  2.48s/ba]100%|██████████| 1/1 [00:02<00:00,  2.48s/ba]
/home/lily/lyf6/miniconda3/envs/simplification/lib/python3.8/site-packages/transformers/optimization.py:346: FutureWarning: This implementation of AdamW is deprecated and will be removed in a future version. Use the PyTorch implementation torch.optim.AdamW instead, or set `no_deprecation_warning=True` to disable this warning
  warnings.warn(
wandb: Currently logged in as: ljyflores_team (use `wandb login --relogin` to force relogin)
wandb: wandb version 0.14.0 is available!  To upgrade, please run:
wandb:  $ pip install wandb --upgrade
wandb: Tracking run with wandb version 0.12.9
wandb: Syncing run curious-cherry-86
wandb:  View project at https://wandb.ai/ljyflores_team/huggingface
wandb:  View run at https://wandb.ai/ljyflores_team/huggingface/runs/ff3njh2h
wandb: Run data is saved locally in /data/lily/lyf6/Simplification-Project/wandb/run-20230326_184320-ff3njh2h
wandb: Run `wandb offline` to turn off syncing.

  0% 0/275 [00:00<?, ?it/s]Traceback (most recent call last):
  File "train.py", line 157, in <module>
    trainer.train()
  File "/home/lily/lyf6/miniconda3/envs/simplification/lib/python3.8/site-packages/transformers/trainer.py", line 1631, in train
    return inner_training_loop(
  File "/home/lily/lyf6/miniconda3/envs/simplification/lib/python3.8/site-packages/transformers/trainer.py", line 1898, in _inner_training_loop
    tr_loss_step = self.training_step(model, inputs)
  File "/home/lily/lyf6/miniconda3/envs/simplification/lib/python3.8/site-packages/transformers/trainer.py", line 2640, in training_step
    loss = self.compute_loss(model, inputs)
  File "/home/lily/lyf6/miniconda3/envs/simplification/lib/python3.8/site-packages/transformers/trainer.py", line 2672, in compute_loss
    outputs = model(**inputs)
  File "/home/lily/lyf6/miniconda3/envs/simplification/lib/python3.8/site-packages/torch/nn/modules/module.py", line 1194, in _call_impl
    return forward_call(*input, **kwargs)
  File "/home/lily/lyf6/miniconda3/envs/simplification/lib/python3.8/site-packages/transformers/models/bart/modeling_bart.py", line 1373, in forward
    outputs = self.model(
  File "/home/lily/lyf6/miniconda3/envs/simplification/lib/python3.8/site-packages/torch/nn/modules/module.py", line 1194, in _call_impl
    return forward_call(*input, **kwargs)
  File "/home/lily/lyf6/miniconda3/envs/simplification/lib/python3.8/site-packages/transformers/models/bart/modeling_bart.py", line 1255, in forward
    decoder_outputs = self.decoder(
  File "/home/lily/lyf6/miniconda3/envs/simplification/lib/python3.8/site-packages/torch/nn/modules/module.py", line 1194, in _call_impl
    return forward_call(*input, **kwargs)
  File "/home/lily/lyf6/miniconda3/envs/simplification/lib/python3.8/site-packages/transformers/models/bart/modeling_bart.py", line 1113, in forward
    layer_outputs = decoder_layer(
  File "/home/lily/lyf6/miniconda3/envs/simplification/lib/python3.8/site-packages/torch/nn/modules/module.py", line 1194, in _call_impl
    return forward_call(*input, **kwargs)
  File "/home/lily/lyf6/miniconda3/envs/simplification/lib/python3.8/site-packages/transformers/models/bart/modeling_bart.py", line 426, in forward
    hidden_states, self_attn_weights, present_key_value = self.self_attn(
  File "/home/lily/lyf6/miniconda3/envs/simplification/lib/python3.8/site-packages/torch/nn/modules/module.py", line 1194, in _call_impl
    return forward_call(*input, **kwargs)
  File "/home/lily/lyf6/miniconda3/envs/simplification/lib/python3.8/site-packages/transformers/models/bart/modeling_bart.py", line 249, in forward
    attn_weights = attn_weights.view(bsz, self.num_heads, tgt_len, src_len) + attention_mask
torch.cuda.OutOfMemoryError: CUDA out of memory. Tried to allocate 144.00 MiB (GPU 0; 23.70 GiB total capacity; 5.01 GiB already allocated; 6.69 MiB free; 5.02 GiB reserved in total by PyTorch) If reserved memory is >> allocated memory try setting max_split_size_mb to avoid fragmentation.  See documentation for Memory Management and PYTORCH_CUDA_ALLOC_CONF
wandb: Waiting for W&B process to finish, PID 1604273... (failed 1). Press ctrl-c to abort syncing.
wandb: - 0.00MB of 0.00MB uploaded (0.00MB deduped)wandb: \ 0.00MB of 0.00MB uploaded (0.00MB deduped)wandb: | 0.00MB of 0.00MB uploaded (0.00MB deduped)wandb: / 0.00MB of 0.01MB uploaded (0.00MB deduped)wandb: - 0.00MB of 0.02MB uploaded (0.00MB deduped)wandb: \ 0.02MB of 0.02MB uploaded (0.00MB deduped)wandb: | 0.02MB of 0.02MB uploaded (0.00MB deduped)wandb: / 0.02MB of 0.02MB uploaded (0.00MB deduped)wandb: - 0.02MB of 0.02MB uploaded (0.00MB deduped)wandb: \ 0.02MB of 0.02MB uploaded (0.00MB deduped)wandb: | 0.02MB of 0.02MB uploaded (0.00MB deduped)wandb: / 0.02MB of 0.02MB uploaded (0.00MB deduped)wandb: - 0.02MB of 0.02MB uploaded (0.00MB deduped)wandb: \ 0.02MB of 0.02MB uploaded (0.00MB deduped)wandb: | 0.02MB of 0.02MB uploaded (0.00MB deduped)wandb: / 0.02MB of 0.02MB uploaded (0.00MB deduped)wandb: - 0.02MB of 0.02MB uploaded (0.00MB deduped)wandb: \ 0.02MB of 0.02MB uploaded (0.00MB deduped)wandb: | 0.02MB of 0.02MB uploaded (0.00MB deduped)wandb: / 0.02MB of 0.02MB uploaded (0.00MB deduped)wandb: - 0.02MB of 0.02MB uploaded (0.00MB deduped)wandb: \ 0.02MB of 0.02MB uploaded (0.00MB deduped)wandb: | 0.02MB of 0.02MB uploaded (0.00MB deduped)wandb: / 0.02MB of 0.02MB uploaded (0.00MB deduped)wandb: - 0.02MB of 0.02MB uploaded (0.00MB deduped)wandb: \ 0.02MB of 0.02MB uploaded (0.00MB deduped)wandb: | 0.02MB of 0.02MB uploaded (0.00MB deduped)wandb: / 0.02MB of 0.02MB uploaded (0.00MB deduped)wandb: - 0.02MB of 0.02MB uploaded (0.00MB deduped)wandb: \ 0.02MB of 0.02MB uploaded (0.00MB deduped)wandb: | 0.02MB of 0.02MB uploaded (0.00MB deduped)wandb:
wandb: Synced 6 W&B file(s), 0 media file(s), 0 artifact file(s) and 0 other file(s)
wandb: Synced curious-cherry-86: https://wandb.ai/ljyflores_team/huggingface/runs/ff3njh2h
wandb: Find logs at: ./wandb/run-20230326_184320-ff3njh2h/logs/debug.log
wandb:

Using custom data configuration default-a76fd4faf6436e13
Reusing dataset json (/home/lily/lyf6/.cache/huggingface/datasets/json/default-a76fd4faf6436e13/0.0.0/ac0ca5f5289a6cf108e706efcf040422dbbfa8e658dee6a819f20d76bb84d26b)
Using dataset: cochrane, Args: 1e-4 (lr), 5 (epochs), 4 (batch_size), None (checkpoint)
  0%|          | 0/1 [00:00<?, ?it/s]100%|██████████| 1/1 [00:00<00:00, 415.57it/s]
Using custom data configuration default-6008f3d38acc97fb
Reusing dataset json (/home/lily/lyf6/.cache/huggingface/datasets/json/default-6008f3d38acc97fb/0.0.0/ac0ca5f5289a6cf108e706efcf040422dbbfa8e658dee6a819f20d76bb84d26b)
  0%|          | 0/1 [00:00<?, ?it/s]100%|██████████| 1/1 [00:00<00:00, 112.14it/s]
Loading cached processed dataset at /home/lily/lyf6/.cache/huggingface/datasets/json/default-a76fd4faf6436e13/0.0.0/ac0ca5f5289a6cf108e706efcf040422dbbfa8e658dee6a819f20d76bb84d26b/cache-b2b2bb8bf981bd62.arrow
  0%|          | 0/1 [00:00<?, ?ba/s]100%|██████████| 1/1 [00:02<00:00,  2.72s/ba]100%|██████████| 1/1 [00:02<00:00,  2.72s/ba]
/home/lily/lyf6/miniconda3/envs/simplification/lib/python3.8/site-packages/transformers/optimization.py:346: FutureWarning: This implementation of AdamW is deprecated and will be removed in a future version. Use the PyTorch implementation torch.optim.AdamW instead, or set `no_deprecation_warning=True` to disable this warning
  warnings.warn(
wandb: Currently logged in as: ljyflores_team (use `wandb login --relogin` to force relogin)
wandb: wandb version 0.14.0 is available!  To upgrade, please run:
wandb:  $ pip install wandb --upgrade
wandb: Tracking run with wandb version 0.12.9
wandb: Syncing run hopeful-frog-87
wandb:  View project at https://wandb.ai/ljyflores_team/huggingface
wandb:  View run at https://wandb.ai/ljyflores_team/huggingface/runs/370ci3no
wandb: Run data is saved locally in /data/lily/lyf6/Simplification-Project/wandb/run-20230326_185211-370ci3no
wandb: Run `wandb offline` to turn off syncing.

  0% 0/275 [00:00<?, ?it/s]  0% 1/275 [00:06<29:59,  6.57s/it]  1% 2/275 [00:11<26:03,  5.73s/it]  1% 3/275 [00:18<27:56,  6.16s/it]  1% 4/275 [00:25<28:58,  6.42s/it]  2% 5/275 [00:31<28:01,  6.23s/it]  2% 6/275 [00:36<27:24,  6.12s/it]  3% 7/275 [00:42<26:52,  6.02s/it]  3% 8/275 [00:47<25:27,  5.72s/it]  3% 9/275 [00:52<24:24,  5.50s/it]  4% 10/275 [00:57<23:37,  5.35s/it]  4% 11/275 [01:02<23:04,  5.25s/it]  4% 12/275 [01:07<22:40,  5.17s/it]  5% 13/275 [01:12<22:26,  5.14s/it]  5% 14/275 [01:18<22:16,  5.12s/it]  5% 15/275 [01:23<22:03,  5.09s/it]  6% 16/275 [01:28<22:00,  5.10s/it]  6% 17/275 [01:33<21:53,  5.09s/it]  7% 18/275 [01:38<21:41,  5.07s/it]  7% 19/275 [01:43<21:41,  5.08s/it]  7% 20/275 [01:48<21:37,  5.09s/it]  8% 21/275 [01:53<21:29,  5.08s/it]  8% 22/275 [01:58<21:30,  5.10s/it]  8% 23/275 [02:03<21:18,  5.07s/it]  9% 24/275 [02:08<21:19,  5.10s/it]  9% 25/275 [02:13<21:14,  5.10s/it]  9% 26/275 [02:19<21:17,  5.13s/it] 10% 27/275 [02:24<21:17,  5.15s/it] 10% 28/275 [02:29<21:09,  5.14s/it] 11% 29/275 [02:34<21:00,  5.12s/it] 11% 30/275 [02:39<20:53,  5.12s/it] 11% 31/275 [02:44<20:43,  5.10s/it] 12% 32/275 [02:49<20:40,  5.11s/it] 12% 33/275 [02:54<20:36,  5.11s/it] 12% 34/275 [03:00<20:30,  5.10s/it] 13% 35/275 [03:05<20:19,  5.08s/it] 13% 36/275 [03:10<20:13,  5.08s/it] 13% 37/275 [03:15<20:07,  5.07s/it] 14% 38/275 [03:20<20:02,  5.07s/it] 14% 39/275 [03:25<19:59,  5.08s/it] 15% 40/275 [03:30<19:49,  5.06s/it] 15% 41/275 [03:35<19:47,  5.08s/it] 15% 42/275 [03:40<19:38,  5.06s/it] 16% 43/275 [03:45<19:35,  5.07s/it] 16% 44/275 [03:50<19:30,  5.07s/it] 16% 45/275 [03:55<19:26,  5.07s/it] 17% 46/275 [04:00<19:17,  5.05s/it] 17% 47/275 [04:05<19:12,  5.06s/it] 17% 48/275 [04:10<19:10,  5.07s/it] 18% 49/275 [04:16<19:09,  5.08s/it] 18% 50/275 [04:21<19:02,  5.08s/it] 19% 51/275 [04:26<18:53,  5.06s/it] 19% 52/275 [04:31<19:00,  5.12s/it] 19% 53/275 [04:36<18:59,  5.13s/it] 20% 54/275 [04:41<18:58,  5.15s/it] 20% 55/275 [04:46<18:51,  5.14s/it]
  0% 0/120 [00:00<?, ?it/s][A
  2% 2/120 [00:00<00:38,  3.03it/s][A
  2% 3/120 [00:01<00:54,  2.14it/s][A
  3% 4/120 [00:01<01:02,  1.87it/s][A
  4% 5/120 [00:02<01:05,  1.75it/s][A
  5% 6/120 [00:03<01:09,  1.64it/s][A
  6% 7/120 [00:03<01:10,  1.61it/s][A
  7% 8/120 [00:04<01:10,  1.59it/s][A
  8% 9/120 [00:05<01:09,  1.59it/s][A
  8% 10/120 [00:05<01:10,  1.57it/s][A
  9% 11/120 [00:06<01:09,  1.57it/s][A
 10% 12/120 [00:07<01:08,  1.57it/s][A
 11% 13/120 [00:07<01:08,  1.57it/s][A
 12% 14/120 [00:08<01:07,  1.57it/s][A
 12% 15/120 [00:09<01:06,  1.58it/s][A
 13% 16/120 [00:09<01:08,  1.52it/s][A
 14% 17/120 [00:10<01:07,  1.53it/s][A
 15% 18/120 [00:11<01:06,  1.54it/s][A
 16% 19/120 [00:11<01:05,  1.54it/s][A
 17% 20/120 [00:12<01:04,  1.55it/s][A
 18% 21/120 [00:12<01:03,  1.56it/s][A
 18% 22/120 [00:13<01:02,  1.58it/s][A
 19% 23/120 [00:14<01:00,  1.60it/s][A
 20% 24/120 [00:14<00:59,  1.61it/s][A
 21% 25/120 [00:15<00:58,  1.61it/s][A
 22% 26/120 [00:16<00:57,  1.62it/s][A
 22% 27/120 [00:16<00:56,  1.64it/s][A
 23% 28/120 [00:17<00:56,  1.63it/s][A
 24% 29/120 [00:17<00:55,  1.64it/s][A
 25% 30/120 [00:18<00:54,  1.64it/s][A
 26% 31/120 [00:19<00:54,  1.64it/s][A
 27% 32/120 [00:19<00:53,  1.65it/s][A
 28% 33/120 [00:20<00:52,  1.66it/s][A
 28% 34/120 [00:20<00:51,  1.65it/s][A
 29% 35/120 [00:21<00:51,  1.65it/s][A
 30% 36/120 [00:22<00:50,  1.65it/s][A
 31% 37/120 [00:22<00:50,  1.64it/s][A
 32% 38/120 [00:23<00:49,  1.65it/s][A
 32% 39/120 [00:23<00:48,  1.65it/s][A
 33% 40/120 [00:24<00:48,  1.66it/s][A
 34% 41/120 [00:25<00:48,  1.64it/s][A
 35% 42/120 [00:25<00:47,  1.65it/s][A
 36% 43/120 [00:26<00:47,  1.63it/s][A
 37% 44/120 [00:26<00:46,  1.63it/s][A
 38% 45/120 [00:27<00:45,  1.64it/s][A
 38% 46/120 [00:28<00:44,  1.64it/s][A
 39% 47/120 [00:28<00:44,  1.65it/s][A
 40% 48/120 [00:29<00:44,  1.62it/s][A
 41% 49/120 [00:30<00:43,  1.63it/s][A
 42% 50/120 [00:30<00:42,  1.64it/s][A
 42% 51/120 [00:31<00:41,  1.64it/s][A
 43% 52/120 [00:31<00:41,  1.62it/s][A
 44% 53/120 [00:32<00:41,  1.61it/s][A
 45% 54/120 [00:33<00:40,  1.63it/s][A
 46% 55/120 [00:33<00:39,  1.63it/s][A
 47% 56/120 [00:34<00:39,  1.64it/s][A
 48% 57/120 [00:34<00:38,  1.63it/s][A
 48% 58/120 [00:35<00:38,  1.63it/s][A
 49% 59/120 [00:36<00:37,  1.61it/s][A
 50% 60/120 [00:36<00:37,  1.62it/s][A
 51% 61/120 [00:37<00:36,  1.63it/s][A
 52% 62/120 [00:37<00:35,  1.64it/s][A
 52% 63/120 [00:38<00:34,  1.64it/s][A
 53% 64/120 [00:39<00:34,  1.63it/s][A
 54% 65/120 [00:39<00:33,  1.63it/s][A
 55% 66/120 [00:40<00:33,  1.62it/s][A
 56% 67/120 [00:41<00:32,  1.64it/s][A
 57% 68/120 [00:41<00:31,  1.64it/s][A
 57% 69/120 [00:42<00:31,  1.62it/s][A
 58% 70/120 [00:42<00:30,  1.63it/s][A
 59% 71/120 [00:43<00:29,  1.64it/s][A
 60% 72/120 [00:44<00:29,  1.64it/s][A
 61% 73/120 [00:44<00:28,  1.64it/s][A
 62% 74/120 [00:45<00:27,  1.65it/s][A
 62% 75/120 [00:45<00:27,  1.65it/s][A
 63% 76/120 [00:46<00:26,  1.66it/s][A
 64% 77/120 [00:47<00:25,  1.66it/s][A
 65% 78/120 [00:47<00:25,  1.66it/s][A
 66% 79/120 [00:48<00:24,  1.66it/s][A
 67% 80/120 [00:48<00:24,  1.64it/s][A
 68% 81/120 [00:49<00:23,  1.63it/s][A
 68% 82/120 [00:50<00:23,  1.64it/s][A
 69% 83/120 [00:50<00:22,  1.64it/s][A
 70% 84/120 [00:51<00:22,  1.63it/s][A
 71% 85/120 [00:52<00:21,  1.63it/s][A
 72% 86/120 [00:52<00:20,  1.64it/s][A
 72% 87/120 [00:53<00:20,  1.65it/s][A
 73% 88/120 [00:53<00:19,  1.63it/s][A
 74% 89/120 [00:54<00:18,  1.64it/s][A
 75% 90/120 [00:55<00:18,  1.65it/s][A
 76% 91/120 [00:55<00:17,  1.65it/s][A
 77% 92/120 [00:56<00:17,  1.63it/s][A
 78% 93/120 [00:56<00:16,  1.65it/s][A
 78% 94/120 [00:57<00:15,  1.63it/s][A
 79% 95/120 [00:58<00:15,  1.62it/s][A
 80% 96/120 [00:58<00:14,  1.62it/s][A
 81% 97/120 [00:59<00:14,  1.63it/s][A
 82% 98/120 [00:59<00:13,  1.64it/s][A
 82% 99/120 [01:00<00:12,  1.65it/s][A
 83% 100/120 [01:01<00:12,  1.66it/s][A
 84% 101/120 [01:01<00:11,  1.66it/s][A
 85% 102/120 [01:02<00:10,  1.66it/s][A
 86% 103/120 [01:02<00:10,  1.65it/s][A
 87% 104/120 [01:03<00:09,  1.65it/s][A
 88% 105/120 [01:04<00:09,  1.66it/s][A
 88% 106/120 [01:04<00:08,  1.65it/s][A
 89% 107/120 [01:05<00:07,  1.64it/s][A
 90% 108/120 [01:06<00:07,  1.64it/s][A
 91% 109/120 [01:06<00:06,  1.63it/s][A
 92% 110/120 [01:07<00:06,  1.60it/s][A
 92% 111/120 [01:07<00:05,  1.58it/s][A
 93% 112/120 [01:08<00:04,  1.61it/s][A
 94% 113/120 [01:09<00:04,  1.59it/s][A
 95% 114/120 [01:09<00:03,  1.61it/s][A
 96% 115/120 [01:10<00:03,  1.62it/s][A
 97% 116/120 [01:11<00:02,  1.63it/s][A
 98% 117/120 [01:11<00:01,  1.63it/s][A
 98% 118/120 [01:12<00:01,  1.64it/s][A
 99% 119/120 [01:12<00:00,  1.63it/s][A
100% 120/120 [01:13<00:00,  1.64it/s][A
                                     [A 20% 55/275 [06:43<18:51,  5.14s/it]
100% 120/120 [01:52<00:00,  1.64it/s][A
                                     [A 20% 56/275 [06:48<2:26:27, 40.13s/it] 21% 57/275 [06:53<1:47:24, 29.56s/it] 21% 58/275 [06:58<1:20:11, 22.17s/it] 21% 59/275 [07:03<1:01:11, 17.00s/it] 22% 60/275 [07:08<47:55, 13.37s/it]   22% 61/275 [07:13<38:41, 10.85s/it] 23% 62/275 [07:18<32:14,  9.08s/it] 23% 63/275 [07:23<28:01,  7.93s/it] 23% 64/275 [07:28<24:56,  7.09s/it] 24% 65/275 [07:33<22:41,  6.48s/it] 24% 66/275 [07:38<21:07,  6.06s/it] 24% 67/275 [07:43<19:57,  5.76s/it] 25% 68/275 [07:48<19:12,  5.57s/it] 25% 69/275 [07:54<18:41,  5.44s/it] 25% 70/275 [07:59<18:12,  5.33s/it] 26% 71/275 [08:04<17:52,  5.26s/it] 26% 72/275 [08:09<17:40,  5.23s/it] 27% 73/275 [08:14<17:22,  5.16s/it] 27% 74/275 [08:19<17:11,  5.13s/it] 27% 75/275 [08:24<17:02,  5.11s/it] 28% 76/275 [08:29<16:50,  5.08s/it] 28% 77/275 [08:34<16:46,  5.08s/it] 28% 78/275 [08:39<16:37,  5.07s/it] 29% 79/275 [08:44<16:35,  5.08s/it] 29% 80/275 [08:49<16:29,  5.08s/it] 29% 81/275 [08:54<16:26,  5.09s/it] 30% 82/275 [09:00<16:19,  5.08s/it] 30% 83/275 [09:05<16:12,  5.07s/it] 31% 84/275 [09:10<16:07,  5.07s/it] 31% 85/275 [09:15<16:03,  5.07s/it] 31% 86/275 [09:20<16:01,  5.09s/it] 32% 87/275 [09:25<16:01,  5.12s/it] 32% 88/275 [09:30<15:51,  5.09s/it] 32% 89/275 [09:35<15:42,  5.07s/it] 33% 90/275 [09:40<15:35,  5.06s/it] 33% 91/275 [09:45<15:33,  5.07s/it] 33% 92/275 [09:50<15:24,  5.05s/it] 34% 93/275 [09:55<15:16,  5.04s/it] 34% 94/275 [10:00<15:14,  5.05s/it] 35% 95/275 [10:05<15:07,  5.04s/it] 35% 96/275 [10:10<15:03,  5.05s/it] 35% 97/275 [10:15<14:58,  5.05s/it] 36% 98/275 [10:21<14:59,  5.08s/it] 36% 99/275 [10:26<14:53,  5.08s/it] 36% 100/275 [10:31<14:47,  5.07s/it] 37% 101/275 [10:36<14:42,  5.07s/it] 37% 102/275 [10:41<14:34,  5.05s/it] 37% 103/275 [10:46<14:34,  5.08s/it] 38% 104/275 [10:51<14:27,  5.07s/it] 38% 105/275 [10:56<14:20,  5.06s/it] 39% 106/275 [11:01<14:14,  5.06s/it] 39% 107/275 [11:06<14:10,  5.06s/it] 39% 108/275 [11:11<14:06,  5.07s/it] 40% 109/275 [11:16<14:01,  5.07s/it] 40% 110/275 [11:21<13:54,  5.06s/it]{'eval_loss': 0.8909199833869934, 'eval_rouge1': 0.0824, 'eval_rouge2': 0.0296, 'eval_rougeL': 0.0676, 'eval_rougeLsum': 0.078, 'eval_bert_score': 0.829, 'eval_sari': 30.8208, 'eval_gen_len': 20.0, 'eval_runtime': 113.0517, 'eval_samples_per_second': 4.246, 'eval_steps_per_second': 1.061, 'epoch': 0.99}

  0% 0/120 [00:00<?, ?it/s][A
  2% 2/120 [00:00<00:40,  2.94it/s][A
  2% 3/120 [00:01<00:55,  2.09it/s][A
  3% 4/120 [00:02<01:04,  1.80it/s][A
  4% 5/120 [00:02<01:08,  1.68it/s][A
  5% 6/120 [00:03<01:09,  1.65it/s][A
  6% 7/120 [00:03<01:08,  1.66it/s][A
  7% 8/120 [00:04<01:08,  1.64it/s][A
  8% 9/120 [00:05<01:08,  1.63it/s][A
  8% 10/120 [00:05<01:07,  1.63it/s][A
  9% 11/120 [00:06<01:06,  1.63it/s][A
 10% 12/120 [00:07<01:06,  1.63it/s][A
 11% 13/120 [00:07<01:06,  1.60it/s][A
 12% 14/120 [00:08<01:06,  1.60it/s][A
 12% 15/120 [00:08<01:05,  1.61it/s][A
 13% 16/120 [00:09<01:04,  1.61it/s][A
 14% 17/120 [00:10<01:03,  1.61it/s][A
 15% 18/120 [00:10<01:02,  1.63it/s][A
 16% 19/120 [00:11<01:01,  1.63it/s][A
 17% 20/120 [00:11<01:02,  1.61it/s][A
 18% 21/120 [00:12<01:01,  1.62it/s][A
 18% 22/120 [00:13<01:01,  1.59it/s][A
 19% 23/120 [00:13<01:02,  1.54it/s][A
 20% 24/120 [00:14<01:03,  1.52it/s][A
 21% 25/120 [00:15<01:02,  1.52it/s][A
 22% 26/120 [00:15<01:00,  1.56it/s][A
 22% 27/120 [00:16<00:59,  1.57it/s][A
 23% 28/120 [00:17<00:59,  1.55it/s][A
 24% 29/120 [00:17<00:58,  1.56it/s][A
 25% 30/120 [00:18<00:57,  1.57it/s][A
 26% 31/120 [00:19<00:57,  1.55it/s][A
 27% 32/120 [00:19<00:57,  1.54it/s][A
 28% 33/120 [00:20<00:56,  1.54it/s][A
 28% 34/120 [00:21<00:54,  1.57it/s][A
 29% 35/120 [00:21<00:53,  1.57it/s][A
 30% 36/120 [00:22<00:53,  1.56it/s][A
 31% 37/120 [00:22<00:53,  1.56it/s][A
 32% 38/120 [00:23<00:51,  1.58it/s][A
 32% 39/120 [00:24<00:51,  1.58it/s][A
 33% 40/120 [00:24<00:51,  1.56it/s][A
 34% 41/120 [00:25<00:49,  1.59it/s][A
 35% 42/120 [00:26<00:48,  1.60it/s][A
 36% 43/120 [00:26<00:48,  1.60it/s][A
 37% 44/120 [00:27<00:48,  1.58it/s][A
 38% 45/120 [00:27<00:46,  1.60it/s][A
 38% 46/120 [00:28<00:46,  1.60it/s][A
 39% 47/120 [00:29<00:45,  1.60it/s][A
 40% 48/120 [00:29<00:44,  1.61it/s][A
 41% 49/120 [00:30<00:43,  1.62it/s][A
 42% 50/120 [00:31<00:43,  1.61it/s][A
 42% 51/120 [00:31<00:42,  1.61it/s][A
 43% 52/120 [00:32<00:41,  1.63it/s][A
 44% 53/120 [00:32<00:41,  1.60it/s][A
 45% 54/120 [00:33<00:41,  1.59it/s][A
 46% 55/120 [00:34<00:41,  1.56it/s][A
 47% 56/120 [00:34<00:40,  1.59it/s][A
 48% 57/120 [00:35<00:40,  1.57it/s][A
 48% 58/120 [00:36<00:39,  1.57it/s][A
 49% 59/120 [00:36<00:38,  1.57it/s][A
 50% 60/120 [00:37<00:37,  1.58it/s][A
 51% 61/120 [00:38<00:37,  1.56it/s][A
 52% 62/120 [00:38<00:37,  1.53it/s][A
 52% 63/120 [00:39<00:37,  1.51it/s][A
 53% 64/120 [00:40<00:36,  1.55it/s][A
 54% 65/120 [00:40<00:35,  1.55it/s][A
 55% 66/120 [00:41<00:34,  1.55it/s][A
 56% 67/120 [00:41<00:33,  1.57it/s][A
 57% 68/120 [00:42<00:32,  1.59it/s][A
 57% 69/120 [00:43<00:33,  1.53it/s][A
 58% 70/120 [00:43<00:32,  1.53it/s][A
 59% 71/120 [00:44<00:31,  1.55it/s][A
 60% 72/120 [00:45<00:30,  1.58it/s][A
 61% 73/120 [00:45<00:29,  1.59it/s][A
 62% 74/120 [00:46<00:29,  1.58it/s][A
 62% 75/120 [00:47<00:28,  1.57it/s][A
 63% 76/120 [00:47<00:27,  1.57it/s][A
 64% 77/120 [00:48<00:27,  1.58it/s][A
 65% 78/120 [00:48<00:26,  1.56it/s][A
 66% 79/120 [00:49<00:26,  1.56it/s][A
 67% 80/120 [00:50<00:25,  1.58it/s][A
 68% 81/120 [00:50<00:24,  1.56it/s][A
 68% 82/120 [00:51<00:24,  1.54it/s][A
 69% 83/120 [00:52<00:24,  1.52it/s][A
 70% 84/120 [00:52<00:24,  1.50it/s][A
 71% 85/120 [00:53<00:23,  1.48it/s][A
 72% 86/120 [00:54<00:22,  1.48it/s][A
 72% 87/120 [00:54<00:22,  1.48it/s][A
 73% 88/120 [00:55<00:20,  1.53it/s][A
 74% 89/120 [00:56<00:19,  1.55it/s][A
 75% 90/120 [00:56<00:19,  1.55it/s][A
 76% 91/120 [00:57<00:19,  1.52it/s][A
 77% 92/120 [00:58<00:18,  1.55it/s][A
 78% 93/120 [00:58<00:17,  1.55it/s][A
 78% 94/120 [00:59<00:17,  1.52it/s][A
 79% 95/120 [01:00<00:16,  1.53it/s][A
 80% 96/120 [01:00<00:15,  1.51it/s][A
 81% 97/120 [01:01<00:15,  1.52it/s][A
 82% 98/120 [01:02<00:14,  1.54it/s][A
 82% 99/120 [01:02<00:13,  1.53it/s][A
 83% 100/120 [01:03<00:12,  1.54it/s][A
 84% 101/120 [01:03<00:12,  1.57it/s][A
 85% 102/120 [01:04<00:11,  1.55it/s][A
 86% 103/120 [01:05<00:10,  1.56it/s][A
 87% 104/120 [01:05<00:10,  1.53it/s][A
 88% 105/120 [01:06<00:09,  1.54it/s][A
 88% 106/120 [01:07<00:09,  1.55it/s][A
 89% 107/120 [01:07<00:08,  1.54it/s][A
 90% 108/120 [01:08<00:07,  1.52it/s][A
 91% 109/120 [01:09<00:07,  1.55it/s][A
 92% 110/120 [01:09<00:06,  1.56it/s][A
 92% 111/120 [01:10<00:05,  1.58it/s][A
 93% 112/120 [01:11<00:05,  1.59it/s][A
 94% 113/120 [01:11<00:04,  1.57it/s][A
 95% 114/120 [01:12<00:03,  1.57it/s][A
 96% 115/120 [01:13<00:03,  1.50it/s][A
 97% 116/120 [01:13<00:02,  1.52it/s][A
 98% 117/120 [01:14<00:01,  1.53it/s][A
 98% 118/120 [01:15<00:01,  1.52it/s][A
 99% 119/120 [01:15<00:00,  1.52it/s][A
100% 120/120 [01:16<00:00,  1.51it/s][A
                                     [A 40% 110/275 [13:15<13:54,  5.06s/it]
100% 120/120 [01:49<00:00,  1.51it/s][A
                                     [A 40% 111/275 [13:20<1:47:23, 39.29s/it] 41% 112/275 [13:26<1:18:52, 29.03s/it] 41% 113/275 [13:31<58:58, 21.84s/it]   41% 114/275 [13:36<45:01, 16.78s/it] 42% 115/275 [13:41<35:23, 13.27s/it] 42% 116/275 [13:46<28:36, 10.80s/it] 43% 117/275 [13:51<23:54,  9.08s/it] 43% 118/275 [13:56<20:33,  7.86s/it] 43% 119/275 [14:01<18:14,  7.01s/it] 44% 120/275 [14:06<16:34,  6.42s/it] 44% 121/275 [14:11<15:27,  6.02s/it] 44% 122/275 [14:16<14:39,  5.75s/it] 45% 123/275 [14:21<14:05,  5.56s/it] 45% 124/275 [14:26<13:36,  5.41s/it] 45% 125/275 [14:31<13:15,  5.30s/it] 46% 126/275 [14:36<13:01,  5.24s/it] 46% 127/275 [14:41<12:48,  5.19s/it] 47% 128/275 [14:47<12:38,  5.16s/it] 47% 129/275 [14:52<12:26,  5.11s/it] 47% 130/275 [14:57<12:17,  5.09s/it] 48% 131/275 [15:02<12:08,  5.06s/it] 48% 132/275 [15:07<12:03,  5.06s/it] 48% 133/275 [15:12<11:55,  5.04s/it] 49% 134/275 [15:17<11:50,  5.04s/it] 49% 135/275 [15:22<11:43,  5.03s/it] 49% 136/275 [15:27<11:37,  5.02s/it] 50% 137/275 [15:32<11:35,  5.04s/it] 50% 138/275 [15:37<11:31,  5.05s/it] 51% 139/275 [15:42<11:28,  5.06s/it] 51% 140/275 [15:47<11:22,  5.06s/it] 51% 141/275 [15:52<11:18,  5.07s/it] 52% 142/275 [15:57<11:15,  5.08s/it] 52% 143/275 [16:02<11:10,  5.08s/it] 52% 144/275 [16:07<11:03,  5.06s/it] 53% 145/275 [16:12<10:58,  5.07s/it] 53% 146/275 [16:17<10:54,  5.07s/it] 53% 147/275 [16:22<10:48,  5.06s/it] 54% 148/275 [16:28<10:43,  5.07s/it] 54% 149/275 [16:33<10:37,  5.06s/it] 55% 150/275 [16:38<10:32,  5.06s/it] 55% 151/275 [16:43<10:31,  5.09s/it] 55% 152/275 [16:48<10:28,  5.11s/it] 56% 153/275 [16:53<10:23,  5.11s/it] 56% 154/275 [16:58<10:20,  5.13s/it] 56% 155/275 [17:03<10:13,  5.11s/it] 57% 156/275 [17:09<10:10,  5.13s/it] 57% 157/275 [17:14<10:05,  5.13s/it] 57% 158/275 [17:19<09:56,  5.10s/it] 58% 159/275 [17:24<09:47,  5.06s/it] 58% 160/275 [17:29<09:38,  5.03s/it] 59% 161/275 [17:34<09:32,  5.02s/it] 59% 162/275 [17:39<09:24,  5.00s/it] 59% 163/275 [17:44<09:19,  5.00s/it] 60% 164/275 [17:49<09:13,  4.99s/it] 60% 165/275 [17:53<09:07,  4.98s/it]{'eval_loss': 0.699237585067749, 'eval_rouge1': 0.0825, 'eval_rouge2': 0.0302, 'eval_rougeL': 0.0683, 'eval_rougeLsum': 0.0778, 'eval_bert_score': 0.829, 'eval_sari': 30.9429, 'eval_gen_len': 20.0, 'eval_runtime': 110.3423, 'eval_samples_per_second': 4.35, 'eval_steps_per_second': 1.088, 'epoch': 1.99}

  0% 0/120 [00:00<?, ?it/s][A
  2% 2/120 [00:00<00:36,  3.24it/s][A
  2% 3/120 [00:01<00:50,  2.30it/s][A
  3% 4/120 [00:01<00:58,  1.97it/s][A
  4% 5/120 [00:02<01:03,  1.82it/s][A
  5% 6/120 [00:03<01:04,  1.77it/s][A
  6% 7/120 [00:03<01:05,  1.71it/s][A
  7% 8/120 [00:04<01:06,  1.68it/s][A
  8% 9/120 [00:04<01:06,  1.66it/s][A
  8% 10/120 [00:05<01:06,  1.65it/s][A
  9% 11/120 [00:06<01:05,  1.66it/s][A
 10% 12/120 [00:06<01:04,  1.67it/s][A
 11% 13/120 [00:07<01:04,  1.66it/s][A
 12% 14/120 [00:07<01:04,  1.66it/s][A
 12% 15/120 [00:08<01:03,  1.65it/s][A
 13% 16/120 [00:09<01:03,  1.65it/s][A
 14% 17/120 [00:09<01:03,  1.62it/s][A
 15% 18/120 [00:10<01:02,  1.63it/s][A
 16% 19/120 [00:11<01:02,  1.62it/s][A
 17% 20/120 [00:11<01:01,  1.61it/s][A
 18% 21/120 [00:12<01:01,  1.60it/s][A
 18% 22/120 [00:12<01:00,  1.62it/s][A
 19% 23/120 [00:13<01:00,  1.60it/s][A
 20% 24/120 [00:14<00:59,  1.62it/s][A
 21% 25/120 [00:14<00:58,  1.63it/s][A
 22% 26/120 [00:15<00:57,  1.64it/s][A
 22% 27/120 [00:15<00:56,  1.65it/s][A
 23% 28/120 [00:16<00:55,  1.65it/s][A
 24% 29/120 [00:17<00:55,  1.65it/s][A
 25% 30/120 [00:17<00:54,  1.65it/s][A
 26% 31/120 [00:18<00:54,  1.64it/s][A
 27% 32/120 [00:18<00:53,  1.65it/s][A
 28% 33/120 [00:19<00:52,  1.66it/s][A
 28% 34/120 [00:20<00:51,  1.66it/s][A
 29% 35/120 [00:20<00:51,  1.66it/s][A
 30% 36/120 [00:21<00:50,  1.66it/s][A
 31% 37/120 [00:21<00:50,  1.65it/s][A
 32% 38/120 [00:22<00:49,  1.65it/s][A
 32% 39/120 [00:23<00:49,  1.65it/s][A
 33% 40/120 [00:23<00:48,  1.66it/s][A
 34% 41/120 [00:24<00:47,  1.67it/s][A
 35% 42/120 [00:24<00:46,  1.68it/s][A
 36% 43/120 [00:25<00:46,  1.67it/s][A
 37% 44/120 [00:26<00:45,  1.67it/s][A
 38% 45/120 [00:26<00:45,  1.66it/s][A
 38% 46/120 [00:27<00:44,  1.65it/s][A
 39% 47/120 [00:28<00:44,  1.65it/s][A
 40% 48/120 [00:28<00:43,  1.64it/s][A
 41% 49/120 [00:29<00:43,  1.64it/s][A
 42% 50/120 [00:29<00:42,  1.64it/s][A
 42% 51/120 [00:30<00:42,  1.61it/s][A
 43% 52/120 [00:31<00:42,  1.61it/s][A
 44% 53/120 [00:31<00:40,  1.64it/s][A
 45% 54/120 [00:32<00:40,  1.64it/s][A
 46% 55/120 [00:32<00:40,  1.62it/s][A
 47% 56/120 [00:33<00:39,  1.61it/s][A
 48% 57/120 [00:34<00:38,  1.62it/s][A
 48% 58/120 [00:34<00:37,  1.64it/s][A
 49% 59/120 [00:35<00:37,  1.65it/s][A
 50% 60/120 [00:35<00:36,  1.65it/s][A
 51% 61/120 [00:36<00:35,  1.67it/s][A
 52% 62/120 [00:37<00:34,  1.67it/s][A
 52% 63/120 [00:37<00:34,  1.65it/s][A
 53% 64/120 [00:38<00:34,  1.62it/s][A
 54% 65/120 [00:39<00:34,  1.62it/s][A
 55% 66/120 [00:39<00:33,  1.61it/s][A
 56% 67/120 [00:40<00:32,  1.63it/s][A
 57% 68/120 [00:40<00:32,  1.62it/s][A
 57% 69/120 [00:41<00:31,  1.62it/s][A
 58% 70/120 [00:42<00:30,  1.62it/s][A
 59% 71/120 [00:42<00:30,  1.62it/s][A
 60% 72/120 [00:43<00:29,  1.63it/s][A
 61% 73/120 [00:43<00:28,  1.64it/s][A
 62% 74/120 [00:44<00:28,  1.64it/s][A
 62% 75/120 [00:45<00:27,  1.64it/s][A
 63% 76/120 [00:45<00:26,  1.64it/s][A
 64% 77/120 [00:46<00:26,  1.61it/s][A
 65% 78/120 [00:47<00:25,  1.63it/s][A
 66% 79/120 [00:47<00:25,  1.64it/s][A
 67% 80/120 [00:48<00:25,  1.60it/s][A
 68% 81/120 [00:48<00:24,  1.60it/s][A
 68% 82/120 [00:49<00:23,  1.59it/s][A
 69% 83/120 [00:50<00:23,  1.60it/s][A
 70% 84/120 [00:50<00:22,  1.60it/s][A
 71% 85/120 [00:51<00:21,  1.62it/s][A
 72% 86/120 [00:52<00:20,  1.63it/s][A
 72% 87/120 [00:52<00:20,  1.62it/s][A
 73% 88/120 [00:53<00:19,  1.64it/s][A
 74% 89/120 [00:53<00:18,  1.64it/s][A
 75% 90/120 [00:54<00:18,  1.63it/s][A
 76% 91/120 [00:55<00:17,  1.64it/s][A
 77% 92/120 [00:55<00:17,  1.62it/s][A
 78% 93/120 [00:56<00:16,  1.63it/s][A
 78% 94/120 [00:56<00:15,  1.65it/s][A
 79% 95/120 [00:57<00:15,  1.65it/s][A
 80% 96/120 [00:58<00:14,  1.65it/s][A
 81% 97/120 [00:58<00:13,  1.65it/s][A
 82% 98/120 [00:59<00:13,  1.65it/s][A
 82% 99/120 [00:59<00:12,  1.65it/s][A
 83% 100/120 [01:00<00:12,  1.66it/s][A
 84% 101/120 [01:01<00:11,  1.66it/s][A
 85% 102/120 [01:01<00:10,  1.64it/s][A
 86% 103/120 [01:02<00:10,  1.64it/s][A
 87% 104/120 [01:02<00:09,  1.63it/s][A
 88% 105/120 [01:03<00:09,  1.62it/s][A
 88% 106/120 [01:04<00:08,  1.64it/s][A
 89% 107/120 [01:04<00:07,  1.64it/s][A
 90% 108/120 [01:05<00:07,  1.64it/s][A
 91% 109/120 [01:06<00:06,  1.63it/s][A
 92% 110/120 [01:06<00:06,  1.63it/s][A
 92% 111/120 [01:07<00:05,  1.64it/s][A
 93% 112/120 [01:07<00:04,  1.64it/s][A
 94% 113/120 [01:08<00:04,  1.65it/s][A
 95% 114/120 [01:09<00:03,  1.61it/s][A
 96% 115/120 [01:09<00:03,  1.61it/s][A
 97% 116/120 [01:10<00:02,  1.63it/s][A
 98% 117/120 [01:10<00:01,  1.62it/s][A
 98% 118/120 [01:11<00:01,  1.61it/s][A
 99% 119/120 [01:12<00:00,  1.64it/s][A
100% 120/120 [01:12<00:00,  1.65it/s][A
                                     [A 60% 165/275 [19:43<09:07,  4.98s/it]
100% 120/120 [01:45<00:00,  1.65it/s][A
                                     [A 60% 166/275 [19:49<1:09:06, 38.04s/it] 61% 167/275 [19:54<50:36, 28.11s/it]   61% 168/275 [19:59<37:44, 21.16s/it] 61% 169/275 [20:04<28:52, 16.34s/it] 62% 170/275 [20:09<22:41, 12.97s/it] 62% 171/275 [20:14<18:20, 10.58s/it] 63% 172/275 [20:19<15:20,  8.93s/it] 63% 173/275 [20:24<13:11,  7.76s/it] 63% 174/275 [20:29<11:41,  6.95s/it] 64% 175/275 [20:34<10:36,  6.36s/it] 64% 176/275 [20:39<09:50,  5.96s/it] 64% 177/275 [20:44<09:18,  5.70s/it] 65% 178/275 [20:49<08:53,  5.50s/it] 65% 179/275 [20:54<08:34,  5.36s/it] 65% 180/275 [20:59<08:20,  5.27s/it] 66% 181/275 [21:04<08:11,  5.23s/it] 66% 182/275 [21:09<08:01,  5.18s/it] 67% 183/275 [21:14<07:51,  5.12s/it] 67% 184/275 [21:19<07:45,  5.12s/it] 67% 185/275 [21:25<07:42,  5.13s/it] 68% 186/275 [21:30<07:34,  5.11s/it] 68% 187/275 [21:35<07:28,  5.10s/it] 68% 188/275 [21:40<07:21,  5.07s/it] 69% 189/275 [21:45<07:16,  5.07s/it] 69% 190/275 [21:50<07:08,  5.04s/it] 69% 191/275 [21:55<07:03,  5.05s/it] 70% 192/275 [22:00<06:59,  5.06s/it] 70% 193/275 [22:05<06:53,  5.04s/it] 71% 194/275 [22:10<06:50,  5.07s/it] 71% 195/275 [22:15<06:46,  5.08s/it] 71% 196/275 [22:20<06:43,  5.10s/it] 72% 197/275 [22:25<06:36,  5.08s/it] 72% 198/275 [22:30<06:31,  5.08s/it] 72% 199/275 [22:36<06:24,  5.06s/it] 73% 200/275 [22:41<06:19,  5.06s/it] 73% 201/275 [22:46<06:13,  5.05s/it] 73% 202/275 [22:51<06:10,  5.08s/it] 74% 203/275 [22:56<06:04,  5.07s/it] 74% 204/275 [23:01<05:59,  5.06s/it] 75% 205/275 [23:06<05:54,  5.06s/it] 75% 206/275 [23:11<05:48,  5.05s/it] 75% 207/275 [23:16<05:42,  5.04s/it] 76% 208/275 [23:21<05:40,  5.09s/it] 76% 209/275 [23:26<05:35,  5.09s/it] 76% 210/275 [23:31<05:30,  5.09s/it] 77% 211/275 [23:36<05:24,  5.06s/it] 77% 212/275 [23:41<05:18,  5.05s/it] 77% 213/275 [23:46<05:14,  5.08s/it] 78% 214/275 [23:52<05:09,  5.08s/it] 78% 215/275 [23:57<05:04,  5.07s/it] 79% 216/275 [24:02<04:58,  5.06s/it] 79% 217/275 [24:07<04:54,  5.08s/it] 79% 218/275 [24:12<04:48,  5.06s/it] 80% 219/275 [24:17<04:42,  5.04s/it] 80% 220/275 [24:22<04:36,  5.03s/it]{'eval_loss': 0.6779072880744934, 'eval_rouge1': 0.0871, 'eval_rouge2': 0.0302, 'eval_rougeL': 0.0707, 'eval_rougeLsum': 0.0821, 'eval_bert_score': 0.827, 'eval_sari': 30.9883, 'eval_gen_len': 20.0, 'eval_runtime': 106.3462, 'eval_samples_per_second': 4.514, 'eval_steps_per_second': 1.128, 'epoch': 2.99}

  0% 0/120 [00:00<?, ?it/s][A
  2% 2/120 [00:00<00:36,  3.20it/s][A
  2% 3/120 [00:01<00:51,  2.26it/s][A
  3% 4/120 [00:01<00:58,  1.98it/s][A
  4% 5/120 [00:02<01:02,  1.85it/s][A
  5% 6/120 [00:03<01:04,  1.76it/s][A
  6% 7/120 [00:03<01:06,  1.70it/s][A
  7% 8/120 [00:04<01:07,  1.66it/s][A
  8% 9/120 [00:04<01:07,  1.65it/s][A
  8% 10/120 [00:05<01:06,  1.65it/s][A
  9% 11/120 [00:06<01:06,  1.65it/s][A
 10% 12/120 [00:06<01:05,  1.66it/s][A
 11% 13/120 [00:07<01:04,  1.65it/s][A
 12% 14/120 [00:08<01:04,  1.64it/s][A
 12% 15/120 [00:08<01:03,  1.64it/s][A
 13% 16/120 [00:09<01:03,  1.64it/s][A
 14% 17/120 [00:09<01:03,  1.63it/s][A
 15% 18/120 [00:10<01:02,  1.64it/s][A
 16% 19/120 [00:11<01:01,  1.65it/s][A
 17% 20/120 [00:11<01:01,  1.63it/s][A
 18% 21/120 [00:12<01:00,  1.63it/s][A
 18% 22/120 [00:12<00:59,  1.64it/s][A
 19% 23/120 [00:13<00:59,  1.63it/s][A
 20% 24/120 [00:14<01:00,  1.58it/s][A
 21% 25/120 [00:14<01:01,  1.54it/s][A
 22% 26/120 [00:15<00:59,  1.57it/s][A
 22% 27/120 [00:16<00:58,  1.59it/s][A
 23% 28/120 [00:16<00:57,  1.60it/s][A
 24% 29/120 [00:17<00:56,  1.62it/s][A
 25% 30/120 [00:17<00:55,  1.61it/s][A
 26% 31/120 [00:18<00:55,  1.61it/s][A
 27% 32/120 [00:19<00:55,  1.60it/s][A
 28% 33/120 [00:19<00:54,  1.60it/s][A
 28% 34/120 [00:20<00:54,  1.59it/s][A
 29% 35/120 [00:21<00:53,  1.59it/s][A
 30% 36/120 [00:21<00:52,  1.59it/s][A
 31% 37/120 [00:22<00:51,  1.60it/s][A
 32% 38/120 [00:22<00:51,  1.58it/s][A
 32% 39/120 [00:23<00:51,  1.58it/s][A
 33% 40/120 [00:24<00:49,  1.62it/s][A
 34% 41/120 [00:24<00:48,  1.62it/s][A
 35% 42/120 [00:25<00:48,  1.61it/s][A
 36% 43/120 [00:26<00:47,  1.61it/s][A
 37% 44/120 [00:26<00:47,  1.59it/s][A
 38% 45/120 [00:27<00:46,  1.60it/s][A
 38% 46/120 [00:27<00:46,  1.58it/s][A
 39% 47/120 [00:28<00:46,  1.58it/s][A
 40% 48/120 [00:29<00:44,  1.60it/s][A
 41% 49/120 [00:29<00:44,  1.59it/s][A
 42% 50/120 [00:30<00:44,  1.56it/s][A
 42% 51/120 [00:31<00:44,  1.57it/s][A
 43% 52/120 [00:31<00:42,  1.59it/s][A
 44% 53/120 [00:32<00:42,  1.59it/s][A
 45% 54/120 [00:33<00:42,  1.56it/s][A
 46% 55/120 [00:33<00:41,  1.58it/s][A
 47% 56/120 [00:34<00:40,  1.59it/s][A
 48% 57/120 [00:34<00:39,  1.58it/s][A
 48% 58/120 [00:35<00:39,  1.57it/s][A
 49% 59/120 [00:36<00:38,  1.59it/s][A
 50% 60/120 [00:36<00:38,  1.56it/s][A
 51% 61/120 [00:37<00:37,  1.57it/s][A
 52% 62/120 [00:38<00:37,  1.53it/s][A
 52% 63/120 [00:38<00:36,  1.55it/s][A
 53% 64/120 [00:39<00:35,  1.57it/s][A
 54% 65/120 [00:40<00:35,  1.56it/s][A
 55% 66/120 [00:40<00:35,  1.53it/s][A
 56% 67/120 [00:41<00:35,  1.51it/s][A
 57% 68/120 [00:42<00:34,  1.49it/s][A
 57% 69/120 [00:42<00:34,  1.50it/s][A
 58% 70/120 [00:43<00:33,  1.47it/s][A
 59% 71/120 [00:44<00:32,  1.50it/s][A
 60% 72/120 [00:44<00:32,  1.49it/s][A
 61% 73/120 [00:45<00:31,  1.51it/s][A
 62% 74/120 [00:46<00:30,  1.53it/s][A
 62% 75/120 [00:46<00:29,  1.54it/s][A
 63% 76/120 [00:47<00:28,  1.56it/s][A
 64% 77/120 [00:47<00:27,  1.57it/s][A
 65% 78/120 [00:48<00:26,  1.56it/s][A
 66% 79/120 [00:49<00:26,  1.57it/s][A
 67% 80/120 [00:49<00:25,  1.59it/s][A
 68% 81/120 [00:50<00:24,  1.58it/s][A
 68% 82/120 [00:51<00:23,  1.59it/s][A
 69% 83/120 [00:51<00:23,  1.61it/s][A
 70% 84/120 [00:52<00:22,  1.61it/s][A
 71% 85/120 [00:53<00:22,  1.57it/s][A
 72% 86/120 [00:53<00:21,  1.55it/s][A
 72% 87/120 [00:54<00:21,  1.57it/s][A
 73% 88/120 [00:54<00:20,  1.57it/s][A
 74% 89/120 [00:55<00:19,  1.58it/s][A
 75% 90/120 [00:56<00:18,  1.60it/s][A
 76% 91/120 [00:56<00:18,  1.61it/s][A
 77% 92/120 [00:57<00:17,  1.56it/s][A
 78% 93/120 [00:58<00:17,  1.57it/s][A
 78% 94/120 [00:58<00:16,  1.58it/s][A
 79% 95/120 [00:59<00:15,  1.58it/s][A
 80% 96/120 [01:00<00:15,  1.58it/s][A
 81% 97/120 [01:00<00:14,  1.59it/s][A
 82% 98/120 [01:01<00:13,  1.61it/s][A
 82% 99/120 [01:01<00:13,  1.58it/s][A
 83% 100/120 [01:02<00:12,  1.57it/s][A
 84% 101/120 [01:03<00:11,  1.59it/s][A
 85% 102/120 [01:03<00:11,  1.60it/s][A
 86% 103/120 [01:04<00:10,  1.61it/s][A
 87% 104/120 [01:05<00:09,  1.61it/s][A
 88% 105/120 [01:05<00:09,  1.62it/s][A
 88% 106/120 [01:06<00:08,  1.61it/s][A
 89% 107/120 [01:06<00:08,  1.60it/s][A
 90% 108/120 [01:07<00:07,  1.60it/s][A
 91% 109/120 [01:08<00:06,  1.61it/s][A
 92% 110/120 [01:08<00:06,  1.61it/s][A
 92% 111/120 [01:09<00:05,  1.57it/s][A
 93% 112/120 [01:10<00:05,  1.52it/s][A
 94% 113/120 [01:10<00:04,  1.56it/s][A
 95% 114/120 [01:11<00:03,  1.57it/s][A
 96% 115/120 [01:11<00:03,  1.56it/s][A
 97% 116/120 [01:12<00:02,  1.56it/s][A
 98% 117/120 [01:13<00:01,  1.59it/s][A
 98% 118/120 [01:13<00:01,  1.59it/s][A
 99% 119/120 [01:14<00:00,  1.59it/s][A
100% 120/120 [01:15<00:00,  1.59it/s][A
                                     [A 80% 220/275 [26:14<04:36,  5.03s/it]
100% 120/120 [01:47<00:00,  1.59it/s][A
                                     [A 80% 221/275 [26:19<34:50, 38.71s/it] 81% 222/275 [26:24<25:16, 28.60s/it] 81% 223/275 [26:29<18:40, 21.55s/it] 81% 224/275 [26:34<14:05, 16.58s/it] 82% 225/275 [26:39<10:55, 13.11s/it] 82% 226/275 [26:44<08:44, 10.70s/it] 83% 227/275 [26:49<07:11,  9.00s/it] 83% 228/275 [26:54<06:07,  7.81s/it] 83% 229/275 [26:59<05:20,  6.97s/it] 84% 230/275 [27:04<04:47,  6.39s/it] 84% 231/275 [27:09<04:23,  5.98s/it] 84% 232/275 [27:14<04:05,  5.70s/it] 85% 233/275 [27:20<03:51,  5.51s/it] 85% 234/275 [27:25<03:41,  5.40s/it] 85% 235/275 [27:30<03:31,  5.29s/it] 86% 236/275 [27:35<03:23,  5.21s/it] 86% 237/275 [27:40<03:15,  5.15s/it] 87% 238/275 [27:45<03:09,  5.12s/it] 87% 239/275 [27:50<03:03,  5.10s/it] 87% 240/275 [27:55<02:58,  5.10s/it] 88% 241/275 [28:00<02:53,  5.09s/it] 88% 242/275 [28:05<02:47,  5.07s/it] 88% 243/275 [28:10<02:41,  5.06s/it] 89% 244/275 [28:15<02:36,  5.04s/it] 89% 245/275 [28:20<02:31,  5.05s/it] 89% 246/275 [28:25<02:26,  5.05s/it] 90% 247/275 [28:30<02:20,  5.04s/it] 90% 248/275 [28:35<02:16,  5.06s/it] 91% 249/275 [28:40<02:11,  5.06s/it] 91% 250/275 [28:45<02:06,  5.04s/it] 91% 251/275 [28:50<02:01,  5.04s/it] 92% 252/275 [28:55<01:55,  5.03s/it] 92% 253/275 [29:00<01:50,  5.01s/it] 92% 254/275 [29:06<01:45,  5.04s/it] 93% 255/275 [29:11<01:41,  5.06s/it] 93% 256/275 [29:16<01:36,  5.06s/it] 93% 257/275 [29:21<01:31,  5.08s/it] 94% 258/275 [29:26<01:26,  5.07s/it] 94% 259/275 [29:31<01:21,  5.11s/it] 95% 260/275 [29:36<01:16,  5.13s/it] 95% 261/275 [29:41<01:11,  5.09s/it] 95% 262/275 [29:46<01:05,  5.06s/it] 96% 263/275 [29:51<01:00,  5.03s/it] 96% 264/275 [29:56<00:55,  5.01s/it] 96% 265/275 [30:01<00:49,  4.99s/it] 97% 266/275 [30:06<00:44,  4.98s/it] 97% 267/275 [30:11<00:39,  4.97s/it] 97% 268/275 [30:16<00:34,  4.97s/it] 98% 269/275 [30:21<00:29,  4.97s/it] 98% 270/275 [30:26<00:24,  4.97s/it] 99% 271/275 [30:31<00:19,  4.96s/it] 99% 272/275 [30:36<00:14,  4.96s/it] 99% 273/275 [30:41<00:09,  4.96s/it]100% 274/275 [30:46<00:04,  4.96s/it]100% 275/275 [30:51<00:00,  4.96s/it]{'eval_loss': 0.6696211695671082, 'eval_rouge1': 0.088, 'eval_rouge2': 0.0339, 'eval_rougeL': 0.073, 'eval_rougeLsum': 0.083, 'eval_bert_score': 0.8314, 'eval_sari': 31.211, 'eval_gen_len': 20.0, 'eval_runtime': 108.5935, 'eval_samples_per_second': 4.42, 'eval_steps_per_second': 1.105, 'epoch': 3.99}

  0% 0/120 [00:00<?, ?it/s][A
  2% 2/120 [00:00<00:38,  3.05it/s][A
  2% 3/120 [00:01<00:53,  2.18it/s][A
  3% 4/120 [00:01<01:00,  1.92it/s][A
  4% 5/120 [00:02<01:03,  1.82it/s][A
  5% 6/120 [00:03<01:04,  1.77it/s][A
  6% 7/120 [00:03<01:05,  1.74it/s][A
  7% 8/120 [00:04<01:04,  1.73it/s][A
  8% 9/120 [00:04<01:05,  1.71it/s][A
  8% 10/120 [00:05<01:04,  1.70it/s][A
  9% 11/120 [00:06<01:04,  1.70it/s][A
 10% 12/120 [00:06<01:03,  1.69it/s][A
 11% 13/120 [00:07<01:05,  1.64it/s][A
 12% 14/120 [00:07<01:05,  1.61it/s][A
 12% 15/120 [00:08<01:05,  1.60it/s][A
 13% 16/120 [00:09<01:04,  1.61it/s][A
 14% 17/120 [00:09<01:03,  1.61it/s][A
 15% 18/120 [00:10<01:03,  1.61it/s][A
 16% 19/120 [00:11<01:02,  1.60it/s][A
 17% 20/120 [00:11<01:01,  1.62it/s][A
 18% 21/120 [00:12<01:00,  1.64it/s][A
 18% 22/120 [00:12<00:59,  1.65it/s][A
 19% 23/120 [00:13<00:58,  1.65it/s][A
 20% 24/120 [00:14<00:58,  1.64it/s][A
 21% 25/120 [00:14<00:58,  1.61it/s][A
 22% 26/120 [00:15<00:58,  1.61it/s][A
 22% 27/120 [00:16<00:57,  1.61it/s][A
 23% 28/120 [00:16<00:56,  1.62it/s][A
 24% 29/120 [00:17<00:56,  1.62it/s][A
 25% 30/120 [00:17<00:55,  1.62it/s][A
 26% 31/120 [00:18<00:54,  1.62it/s][A
 27% 32/120 [00:19<00:54,  1.63it/s][A
 28% 33/120 [00:19<00:53,  1.61it/s][A
 28% 34/120 [00:20<00:53,  1.62it/s][A
 29% 35/120 [00:20<00:52,  1.62it/s][A
 30% 36/120 [00:21<00:52,  1.60it/s][A
 31% 37/120 [00:22<00:51,  1.62it/s][A
 32% 38/120 [00:22<00:50,  1.63it/s][A
 32% 39/120 [00:23<00:49,  1.63it/s][A
 33% 40/120 [00:24<00:48,  1.64it/s][A
 34% 41/120 [00:24<00:47,  1.65it/s][A
 35% 42/120 [00:25<00:47,  1.65it/s][A
 36% 43/120 [00:25<00:47,  1.64it/s][A
 37% 44/120 [00:26<00:46,  1.63it/s][A
 38% 45/120 [00:27<00:46,  1.62it/s][A
 38% 46/120 [00:27<00:45,  1.61it/s][A
 39% 47/120 [00:28<00:44,  1.62it/s][A
 40% 48/120 [00:28<00:43,  1.65it/s][A
 41% 49/120 [00:29<00:43,  1.65it/s][A
 42% 50/120 [00:30<00:42,  1.65it/s][A
 42% 51/120 [00:30<00:41,  1.65it/s][A
 43% 52/120 [00:31<00:41,  1.65it/s][A
 44% 53/120 [00:31<00:40,  1.65it/s][A
 45% 54/120 [00:32<00:39,  1.65it/s][A
 46% 55/120 [00:33<00:39,  1.65it/s][A
 47% 56/120 [00:33<00:38,  1.66it/s][A
 48% 57/120 [00:34<00:38,  1.66it/s][A
 48% 58/120 [00:34<00:37,  1.66it/s][A
 49% 59/120 [00:35<00:37,  1.65it/s][A
 50% 60/120 [00:36<00:36,  1.65it/s][A
 51% 61/120 [00:36<00:35,  1.64it/s][A
 52% 62/120 [00:37<00:35,  1.64it/s][A
 52% 63/120 [00:38<00:34,  1.64it/s][A
 53% 64/120 [00:38<00:35,  1.56it/s][A
 54% 65/120 [00:39<00:34,  1.57it/s][A
 55% 66/120 [00:39<00:34,  1.57it/s][A
 56% 67/120 [00:40<00:33,  1.59it/s][A
 57% 68/120 [00:41<00:31,  1.63it/s][A
 57% 69/120 [00:41<00:31,  1.61it/s][A
 58% 70/120 [00:42<00:31,  1.61it/s][A
 59% 71/120 [00:43<00:30,  1.63it/s][A
 60% 72/120 [00:43<00:28,  1.66it/s][A
 61% 73/120 [00:44<00:28,  1.67it/s][A
 62% 74/120 [00:44<00:27,  1.69it/s][A
 62% 75/120 [00:45<00:26,  1.70it/s][A
 63% 76/120 [00:45<00:25,  1.72it/s][A
 64% 77/120 [00:46<00:25,  1.72it/s][A
 65% 78/120 [00:47<00:24,  1.74it/s][A
 66% 79/120 [00:47<00:23,  1.75it/s][A
 67% 80/120 [00:48<00:22,  1.76it/s][A
 68% 81/120 [00:48<00:22,  1.76it/s][A
 68% 82/120 [00:49<00:21,  1.76it/s][A
 69% 83/120 [00:49<00:21,  1.75it/s][A
 70% 84/120 [00:50<00:20,  1.74it/s][A
 71% 85/120 [00:51<00:20,  1.73it/s][A
 72% 86/120 [00:51<00:19,  1.72it/s][A
 72% 87/120 [00:52<00:19,  1.71it/s][A
 73% 88/120 [00:52<00:18,  1.71it/s][A
 74% 89/120 [00:53<00:18,  1.70it/s][A
 75% 90/120 [00:54<00:17,  1.69it/s][A
 76% 91/120 [00:54<00:17,  1.69it/s][A
 77% 92/120 [00:55<00:16,  1.68it/s][A
 78% 93/120 [00:55<00:16,  1.69it/s][A
 78% 94/120 [00:56<00:15,  1.69it/s][A
 79% 95/120 [00:56<00:14,  1.69it/s][A
 80% 96/120 [00:57<00:14,  1.66it/s][A
 81% 97/120 [00:58<00:13,  1.65it/s][A
 82% 98/120 [00:58<00:13,  1.65it/s][A
 82% 99/120 [00:59<00:12,  1.64it/s][A
 83% 100/120 [01:00<00:12,  1.64it/s][A
 84% 101/120 [01:00<00:11,  1.58it/s][A
 85% 102/120 [01:01<00:11,  1.54it/s][A
 86% 103/120 [01:02<00:11,  1.51it/s][A
 87% 104/120 [01:02<00:10,  1.55it/s][A
 88% 105/120 [01:03<00:09,  1.57it/s][A
 88% 106/120 [01:04<00:09,  1.50it/s][A
 89% 107/120 [01:04<00:08,  1.49it/s][A
 90% 108/120 [01:05<00:08,  1.42it/s][A
 91% 109/120 [01:06<00:07,  1.48it/s][A
 92% 110/120 [01:06<00:06,  1.49it/s][A
 92% 111/120 [01:07<00:06,  1.49it/s][A
 93% 112/120 [01:08<00:05,  1.54it/s][A
 94% 113/120 [01:08<00:04,  1.54it/s][A
 95% 114/120 [01:09<00:03,  1.57it/s][A
 96% 115/120 [01:09<00:03,  1.58it/s][A
 97% 116/120 [01:10<00:02,  1.52it/s][A
 98% 117/120 [01:11<00:01,  1.53it/s][A
 98% 118/120 [01:11<00:01,  1.56it/s][A
 99% 119/120 [01:12<00:00,  1.53it/s][A
100% 120/120 [01:13<00:00,  1.58it/s][A
                                     [A100% 275/275 [32:37<00:00,  4.96s/it]
100% 120/120 [01:45<00:00,  1.58it/s][A
                                     [A                                     100% 275/275 [32:37<00:00,  4.96s/it]100% 275/275 [32:37<00:00,  7.12s/it]
{'eval_loss': 0.66804438829422, 'eval_rouge1': 0.0873, 'eval_rouge2': 0.0328, 'eval_rougeL': 0.0724, 'eval_rougeLsum': 0.0823, 'eval_bert_score': 0.8305, 'eval_sari': 31.1445, 'eval_gen_len': 20.0, 'eval_runtime': 106.4658, 'eval_samples_per_second': 4.508, 'eval_steps_per_second': 1.127, 'epoch': 4.99}
{'train_runtime': 1964.4973, 'train_samples_per_second': 9.081, 'train_steps_per_second': 0.14, 'train_loss': 1.5260994096235796, 'epoch': 4.99}
  0% 0/120 [00:00<?, ?it/s]  2% 2/120 [00:00<00:34,  3.42it/s]  2% 3/120 [00:01<00:50,  2.30it/s]  3% 4/120 [00:01<00:58,  1.98it/s]  4% 5/120 [00:02<01:01,  1.86it/s]  5% 6/120 [00:03<01:04,  1.76it/s]  6% 7/120 [00:03<01:06,  1.71it/s]  7% 8/120 [00:04<01:07,  1.67it/s]  8% 9/120 [00:04<01:09,  1.61it/s]  8% 10/120 [00:05<01:08,  1.61it/s]  9% 11/120 [00:06<01:08,  1.60it/s] 10% 12/120 [00:06<01:08,  1.59it/s] 11% 13/120 [00:07<01:06,  1.61it/s] 12% 14/120 [00:08<01:09,  1.53it/s] 12% 15/120 [00:08<01:08,  1.53it/s] 13% 16/120 [00:09<01:07,  1.55it/s] 14% 17/120 [00:10<01:05,  1.57it/s] 15% 18/120 [00:10<01:04,  1.58it/s] 16% 19/120 [00:11<01:04,  1.57it/s] 17% 20/120 [00:12<01:04,  1.54it/s] 18% 21/120 [00:12<01:03,  1.55it/s] 18% 22/120 [00:13<01:02,  1.56it/s] 19% 23/120 [00:14<01:03,  1.54it/s] 20% 24/120 [00:14<01:03,  1.50it/s] 21% 25/120 [00:15<01:02,  1.52it/s] 22% 26/120 [00:15<01:00,  1.55it/s] 22% 27/120 [00:16<00:58,  1.58it/s] 23% 28/120 [00:17<00:58,  1.58it/s] 24% 29/120 [00:17<00:57,  1.57it/s] 25% 30/120 [00:18<00:57,  1.57it/s] 26% 31/120 [00:19<00:57,  1.56it/s] 27% 32/120 [00:19<00:56,  1.55it/s] 28% 33/120 [00:20<00:55,  1.56it/s] 28% 34/120 [00:21<00:54,  1.57it/s] 29% 35/120 [00:21<00:55,  1.54it/s] 30% 36/120 [00:22<00:53,  1.56it/s] 31% 37/120 [00:23<00:53,  1.54it/s] 32% 38/120 [00:23<00:52,  1.56it/s] 32% 39/120 [00:24<00:53,  1.52it/s] 33% 40/120 [00:24<00:52,  1.51it/s] 34% 41/120 [00:25<00:51,  1.54it/s] 35% 42/120 [00:26<00:50,  1.56it/s] 36% 43/120 [00:26<00:48,  1.58it/s] 37% 44/120 [00:27<00:47,  1.58it/s] 38% 45/120 [00:28<00:47,  1.59it/s] 38% 46/120 [00:28<00:46,  1.60it/s] 39% 47/120 [00:29<00:45,  1.60it/s] 40% 48/120 [00:29<00:45,  1.59it/s] 41% 49/120 [00:30<00:44,  1.60it/s] 42% 50/120 [00:31<00:43,  1.60it/s] 42% 51/120 [00:31<00:42,  1.61it/s] 43% 52/120 [00:32<00:42,  1.60it/s] 44% 53/120 [00:33<00:41,  1.61it/s] 45% 54/120 [00:33<00:41,  1.61it/s] 46% 55/120 [00:34<00:40,  1.60it/s] 47% 56/120 [00:34<00:39,  1.61it/s] 48% 57/120 [00:35<00:38,  1.62it/s] 48% 58/120 [00:36<00:38,  1.62it/s] 49% 59/120 [00:36<00:38,  1.60it/s] 50% 60/120 [00:37<00:37,  1.62it/s] 51% 61/120 [00:38<00:36,  1.63it/s] 52% 62/120 [00:38<00:35,  1.63it/s] 52% 63/120 [00:39<00:35,  1.59it/s] 53% 64/120 [00:39<00:35,  1.58it/s] 54% 65/120 [00:40<00:34,  1.58it/s] 55% 66/120 [00:41<00:34,  1.58it/s] 56% 67/120 [00:41<00:33,  1.57it/s] 57% 68/120 [00:42<00:32,  1.58it/s] 57% 69/120 [00:43<00:31,  1.59it/s] 58% 70/120 [00:43<00:31,  1.58it/s] 59% 71/120 [00:44<00:31,  1.55it/s] 60% 72/120 [00:45<00:30,  1.57it/s] 61% 73/120 [00:45<00:29,  1.59it/s] 62% 74/120 [00:46<00:28,  1.59it/s] 62% 75/120 [00:46<00:28,  1.60it/s] 63% 76/120 [00:47<00:27,  1.62it/s] 64% 77/120 [00:48<00:26,  1.59it/s] 65% 78/120 [00:48<00:26,  1.60it/s] 66% 79/120 [00:49<00:25,  1.60it/s] 67% 80/120 [00:49<00:24,  1.61it/s] 68% 81/120 [00:50<00:24,  1.58it/s] 68% 82/120 [00:51<00:23,  1.59it/s] 69% 83/120 [00:51<00:23,  1.58it/s] 70% 84/120 [00:52<00:22,  1.60it/s] 71% 85/120 [00:53<00:21,  1.60it/s] 72% 86/120 [00:53<00:21,  1.59it/s] 72% 87/120 [00:54<00:20,  1.58it/s] 73% 88/120 [00:55<00:20,  1.60it/s] 74% 89/120 [00:55<00:19,  1.60it/s] 75% 90/120 [00:56<00:18,  1.60it/s] 76% 91/120 [00:56<00:17,  1.61it/s] 77% 92/120 [00:57<00:17,  1.61it/s] 78% 93/120 [00:58<00:17,  1.57it/s] 78% 94/120 [00:58<00:16,  1.55it/s] 79% 95/120 [00:59<00:15,  1.58it/s] 80% 96/120 [01:00<00:15,  1.57it/s] 81% 97/120 [01:00<00:14,  1.59it/s] 82% 98/120 [01:01<00:13,  1.59it/s] 82% 99/120 [01:01<00:13,  1.59it/s] 83% 100/120 [01:02<00:12,  1.61it/s] 84% 101/120 [01:03<00:11,  1.60it/s] 85% 102/120 [01:03<00:11,  1.60it/s] 86% 103/120 [01:04<00:10,  1.60it/s] 87% 104/120 [01:05<00:10,  1.59it/s] 88% 105/120 [01:05<00:09,  1.59it/s] 88% 106/120 [01:06<00:08,  1.59it/s] 89% 107/120 [01:06<00:08,  1.59it/s] 90% 108/120 [01:07<00:07,  1.58it/s] 91% 109/120 [01:08<00:07,  1.55it/s] 92% 110/120 [01:08<00:06,  1.57it/s] 92% 111/120 [01:09<00:05,  1.58it/s] 93% 112/120 [01:10<00:05,  1.58it/s] 94% 113/120 [01:10<00:04,  1.56it/s] 95% 114/120 [01:11<00:03,  1.55it/s] 96% 115/120 [01:12<00:03,  1.57it/s] 97% 116/120 [01:12<00:02,  1.57it/s] 98% 117/120 [01:13<00:01,  1.60it/s] 98% 118/120 [01:13<00:01,  1.61it/s] 99% 119/120 [01:14<00:00,  1.61it/s]100% 120/120 [01:15<00:00,  1.61it/s]100% 120/120 [01:47<00:00,  1.12it/s]
Done
wandb: Waiting for W&B process to finish, PID 1611203... (success).
wandb: - 0.00MB of 0.00MB uploaded (0.00MB deduped)wandb: \ 0.00MB of 0.00MB uploaded (0.00MB deduped)wandb: | 0.00MB of 0.00MB uploaded (0.00MB deduped)wandb: / 0.00MB of 0.02MB uploaded (0.00MB deduped)wandb: - 0.00MB of 0.02MB uploaded (0.00MB deduped)wandb: \ 0.01MB of 0.02MB uploaded (0.00MB deduped)wandb: | 0.01MB of 0.02MB uploaded (0.00MB deduped)wandb: / 0.01MB of 0.02MB uploaded (0.00MB deduped)wandb: - 0.01MB of 0.02MB uploaded (0.00MB deduped)wandb: \ 0.01MB of 0.02MB uploaded (0.00MB deduped)wandb: | 0.01MB of 0.02MB uploaded (0.00MB deduped)wandb: / 0.01MB of 0.02MB uploaded (0.00MB deduped)wandb: - 0.01MB of 0.02MB uploaded (0.00MB deduped)wandb: \ 0.01MB of 0.02MB uploaded (0.00MB deduped)wandb: | 0.01MB of 0.02MB uploaded (0.00MB deduped)wandb: / 0.01MB of 0.02MB uploaded (0.00MB deduped)wandb: - 0.02MB of 0.02MB uploaded (0.00MB deduped)wandb: \ 0.02MB of 0.02MB uploaded (0.00MB deduped)wandb: | 0.02MB of 0.02MB uploaded (0.00MB deduped)wandb: / 0.02MB of 0.02MB uploaded (0.00MB deduped)wandb: - 0.02MB of 0.02MB uploaded (0.00MB deduped)wandb: \ 0.02MB of 0.02MB uploaded (0.00MB deduped)wandb:
wandb: Run history:
wandb:                  eval/bert_score ▄▄▁█▇
wandb:                     eval/gen_len ▁▁▁▁▁
wandb:                        eval/loss █▂▁▁▁
wandb:                      eval/rouge1 ▁▁▇█▇
wandb:                      eval/rouge2 ▁▂▂█▆
wandb:                      eval/rougeL ▁▂▅█▇
wandb:                   eval/rougeLsum ▁▁▇█▇
wandb:                     eval/runtime █▅▁▃▁
wandb:          eval/samples_per_second ▁▄█▆█
wandb:                        eval/sari ▁▃▄█▇
wandb:            eval/steps_per_second ▁▄█▆█
wandb:                      train/epoch ▁▃▅▆██
wandb:                train/global_step ▁▃▄▆██
wandb:                 train/total_flos ▁
wandb:                 train/train_loss ▁
wandb:              train/train_runtime ▁
wandb:   train/train_samples_per_second ▁
wandb:     train/train_steps_per_second ▁
wandb:
wandb: Run summary:
wandb:                  eval/bert_score 0.8305
wandb:                     eval/gen_len 20.0
wandb:                        eval/loss 0.66804
wandb:                      eval/rouge1 0.0873
wandb:                      eval/rouge2 0.0328
wandb:                      eval/rougeL 0.0724
wandb:                   eval/rougeLsum 0.0823
wandb:                     eval/runtime 106.4658
wandb:          eval/samples_per_second 4.508
wandb:                        eval/sari 31.1445
wandb:            eval/steps_per_second 1.127
wandb:                      train/epoch 4.99
wandb:                train/global_step 275
wandb:                 train/total_flos 1.927856254038835e+16
wandb:                 train/train_loss 1.5261
wandb:              train/train_runtime 1964.4973
wandb:   train/train_samples_per_second 9.081
wandb:     train/train_steps_per_second 0.14
wandb:
wandb: Synced 6 W&B file(s), 0 media file(s), 0 artifact file(s) and 0 other file(s)
wandb: Synced hopeful-frog-87: https://wandb.ai/ljyflores_team/huggingface/runs/370ci3no
wandb: Find logs at: ./wandb/run-20230326_185211-370ci3no/logs/debug.log
wandb:
